Identifier,Name,Description,Organisational Structure,Primary Activity,Activities,Street Address,Locality,Region,Postcode,Country ID,Territory ID,Website,Phone,Email,Twitter,Facebook,Companies House Number,Qualifiers,Membership Type,Latitude,Longitude,Geo Container,Geo Container Latitude,Geo Container Longitude,Sector,SIC Section,SIC Code,Ownership Classification,Legal Form,Legal Form Subcategory 1,Legal Form Subcategory 1,UK Nation,Type of Organisation,Registered Status,Registered Number,Registrar,Incorporation Date,Dissolved Date,Organisation Name,WC Legal Form
R014723,GreenBristol,A workers co-operative established to promote community sustainability and raise environmental awareness.,https://dev.lod.coop/essglobal/2.1/standard/organisational-structure/OS50,https://dev.lod.coop/essglobal/2.1/standard/activities-ica/ICA270,,45 Kenwyn Road,Wallasey,Wirral,CH45 4LS,GB,,http://www.greenbristol.blogspot.com,,,,,05757292,,https://dev.lod.coop/essglobal/2.1/standard/base-membership-type/BMT30,,,,,,Education,Education,85590,Workers,Company,,,England,,Live,05757292,Companies House,2006-03-27,,GreenBristol Ltd,
R014733,Allied Aerosystems,"Allied Aerosystems specialise in the calibration and repair of test equipment from all sectors of aerospace, engineering, automotive and manufacturing.",https://dev.lod.coop/essglobal/2.1/standard/organisational-structure/OS50,https://dev.lod.coop/essglobal/2.1/standard/activities-ica/ICA120,,"Unit G1
Treforest Industrial Estate",Pontypridd,"Rhondda, Cynon, Taf",CF37 5YL,GB,,http://www.allied-aerosystems.co.uk,,,,,03445123,,https://dev.lod.coop/essglobal/2.1/standard/base-membership-type/BMT30,,,,,,Manufacturing,Manufacturing,33190,Workers,Company,,,Wales,,Live,03445123,Companies House,1997-10-06,,Allied Aerosystems Limited,
R014299,IAP UK,I.A.P Services is a workers co-operative supplying computers and training for foster children and foster carers. They also help set up office networks and provide support and maintenance of office computers and associated IT infrastructure. We also provide a safe data destruction service to central government standards.,https://dev.lod.coop/essglobal/2.1/standard/organisational-structure/OS50,https://dev.lod.coop/essglobal/2.1/standard/activities-ica/ICA280,,"33 Hopps Road 
Kingswood",Bristol,South Gloucestershire,BS15 9QQ,GB,,http://www.iapuk.biz,,,,,05398581,,https://dev.lod.coop/essglobal/2.1/standard/base-membership-type/BMT30,,,,,,"Digital, Media and Communication",Information and Communication,62000,Workers,Company,,,England,,Live,05398581,Companies House,2005-03-18,,IAP(UK) Ltd,
R014300,Ecomotive,"Ecomotive is a workers’ co-operative which grew out of the Ashley Vale self build project in Bristol. After they had completed their own self build home, Jackson Moulding and Anna Hope wanted to be able to offer other people the same opportunity to design and build their own homes in a community setting. And so Ecomotive was born. Our name (Eco = from the Greek root of ‘home’; Motive = ‘reason for action’) symbolises the way in which we take action to create opportunities for more sustainable homes, and empower others to do the same. Over the years we have grown and evolved, building up a strong core team supported by an inspiring collective of professional associates and volunteers.

Ecomotive operates in many different spheres, from the grassroots through to the national policy arena. You might equally see us giving a presentation at a housing conference or a spontaneous radio interview on the stage of a music festival. We are passionate about what we do and are willing to go the extra mile in order to bring quality to every area of our work. We especially love to get hands-on, and a highlight of our year is building the Ecomotive ‘structure’ at Glastonbury Festival. Our ethos is to be creative, flexible and solution-focused and we enjoy taking on a bit of a challenge!",https://dev.lod.coop/essglobal/2.1/standard/organisational-structure/OS130,https://dev.lod.coop/essglobal/2.1/standard/activities-ica/ICA210,,"Wild Goose Space Unit 2
288a Mina Road
St. Werburghs",Bristol,"Bristol, City of",BS2 9YP,GB,,http://www.ecomotive.org,,,,,,,https://dev.lod.coop/essglobal/2.1/standard/base-membership-type/BMT30,,,,,,Housing,Real Estate,68100,Workers,Society,,,England,,Live,32087R,FCA,2001-06-26,,Ecomotive Limited,
R014310,B Active N B Fit,B’ Active ‘N’ B’ Fit is an Award Winning Company that is dedicated to tailoring structured exercise programmes and well-being services to suit individual need in the local communities with a public health focus.,https://dev.lod.coop/essglobal/2.1/standard/organisational-structure/OS120,https://dev.lod.coop/essglobal/2.1/standard/activities-ica/ICA280,,12 Ocean Road South,Sunderland,Sunderland,SR2 9QT,GB,,http://www.bactivenbfit.co.uk,,,,,05419521,,https://dev.lod.coop/essglobal/2.1/standard/base-membership-type/BMT30,,,,,,Sports and Recreation,"Arts, Entertainment and Recreation",93130,Workers,Community Interest Company,,,England,,Live,05419521,Companies House,2005-04-11,,B' ACTIVE 'N' B' FIT CIC,
R014525,GW Theatre Company,"Based in Greater Manchester GW Theatre is one of the country’s leading theatre companies specialising in creating and delivering powerful, high quality original theatre productions aimed at young people and children as well as carers, parents, the wider community and professionals.",https://dev.lod.coop/essglobal/2.1/standard/organisational-structure/OS50,https://dev.lod.coop/essglobal/2.1/standard/activities-ica/ICA280,,"The Old School House
18 Carrhill Road",Mossley,Tameside,OL5 0QT,GB,,http://www.gwtheatre.co.uk,,,,,02152117,,https://dev.lod.coop/essglobal/2.1/standard/base-membership-type/BMT30,,,,,,Arts and Culture,"Arts, Entertainment and Recreation",90030,Workers,Company,,,England,,Live,02152117,Companies House,1987-07-31,,G.W. Theatre Company Limited,
R014528,Primepac Solutions,Employee Owned packing business,https://dev.lod.coop/essglobal/2.1/standard/organisational-structure/OS50,https://dev.lod.coop/essglobal/2.1/standard/activities-ica/ICA90,,"Unit 36
Rassau Industrial Estate",Ebbw Vale,Blaenau Gwent,NP23 5SD,GB,,http://www.primepacsolutions.co.uk,,,,,05536723,,https://dev.lod.coop/essglobal/2.1/standard/base-membership-type/BMT30,,,,,,Manufacturing,Manufacturing,32990,Workers,Company,,,Wales,,Live,05536723,Companies House,2005-08-15,,Primepac Solutions Ltd,
R014752,Glenowen Fisheries Workers Co-op,,https://dev.lod.coop/essglobal/2.1/standard/organisational-structure/OS50,https://dev.lod.coop/essglobal/2.1/standard/activities-ica/ICA50,,"Creggan Country Park
Westway",Derry,Derry and Strabane,BT48 9NU,GB,,,,,,,NI021650,,https://dev.lod.coop/essglobal/2.1/standard/base-membership-type/BMT30,,,,,,Agriculture,"Agriculture, Forestry and Fishing",03000,Workers,Company,,,Northern Ireland,,Live,NI021650,Companies House,1988-06-10,,Glenowen Fisheries Workers Co-op Ltd,
R014775,Meadows Out of School Club,,https://dev.lod.coop/essglobal/2.1/standard/organisational-structure/OS50,https://dev.lod.coop/essglobal/2.1/standard/activities-ica/ICA120,,"Charter House, Wyvern Court
Stanier Way
Wyvern Business Park",Derby,Derby,DE21 6BF,GB,,,,,,,05840141,,https://dev.lod.coop/essglobal/2.1/standard/base-membership-type/BMT30,,,,,,Other,Other Service Activities,96090,Workers,Company,,,England,,Live,05840141,Companies House,2006-06-07,,Meadows Out of School Club Ltd,
R014847,Whikidz,"At Whikidz we provide parents with a safe, reliable and fun before and after school childcare option. We also offer fun holiday club sessions.

Our club has a very relaxed but fun feel to it! We fully appreciate that children may be tired at the end of a long school day and may simply just want to 'chill out' during their time with us. Children love to choose activities to take part in and our staff enjoy following their interests. The club also gives our children a chance to catch up with old friends or to make new ones.",https://dev.lod.coop/essglobal/2.1/standard/organisational-structure/OS50,https://dev.lod.coop/essglobal/2.1/standard/activities-ica/ICA270,,"Whitkirk Primary School
Templegate Walk",Leeds,Leeds,LS15 0EU,GB,,http://www.whikidz.com/,,,,,05940950,,https://dev.lod.coop/essglobal/2.1/standard/base-membership-type/BMT30,,,,,,Health and Social Care,Human Health and Social Work,88910,Workers,Company,,,England,,Live,05940950,Companies House,2006-09-20,,Whitkirk Kidz Club Co-operative Ltd,
R015153,Transition By Design Cooperative,"Transition By Design is a cross-disciplinary design co-op operating at the junction of architecture, strategic design and social change practice. Our work focuses on the transition to an equitable and convivial low-carbon society.

We work best collaboratively with multiple partners and it is through this process that we believe the most relevant and creative responses are produced.",https://dev.lod.coop/essglobal/2.1/standard/organisational-structure/OS120,https://dev.lod.coop/essglobal/2.1/standard/activities-ica/ICA110,,"MakeSpace Oxford
1 Aristotle Lane",Oxford,Oxfordshire,OX2 6TP,GB,,http://www.transitionbydesign.org,,,,,09664511,,https://dev.lod.coop/essglobal/2.1/standard/base-membership-type/BMT30,,,,,,"Digital, Media and Communication","Professional, Scientific and Technical",74100,Workers,Community Interest Company,,,England,,Live,09664511,Companies House,2015-06-30,,Transition By Design Cooperative CIC,
R020840,Harvest Workers' Co-op,"The Harvest Workers' Co-op is a not-for-profit workers' co-op. We work to improve access to, and knowledge of, healthy food which is ecologically and sustainably produced for the Okehampton population and the surrounding area. We promote: 
* locally produced organic and sustainable food
* learning opportunities on all aspects of food production and consumption and its link to social environmental and health issues
* support for a resilient local economy",https://dev.lod.coop/essglobal/2.1/standard/organisational-structure/OS50,https://dev.lod.coop/essglobal/2.1/standard/activities-ica/ICA260,,5 Red Lion Yard,Okehampton,Devon,EX20 1AW,GB,,http://www.harvestworkerscoop.org.uk,,,,,10636850,,https://dev.lod.coop/essglobal/2.1/standard/base-membership-type/BMT30,,,,,,Retail,Wholesale and Retail; Vehicle Repair,47210,Workers,Company,,,England,,Live,10636850,Companies House,2017-02-23,,Harvest Workers' Co-op Ltd,
R030998,Horsham Taxi Co-operative,Taxi co-operative,https://dev.lod.coop/essglobal/2.1/standard/organisational-structure/OS130,https://dev.lod.coop/essglobal/2.1/standard/activities-ica/ICA220,,60 Wordsworth Place,Horsham,West Sussex,RH12 5PS,GB,,http://www.horshamtaxis.co.uk,,,,,,,https://dev.lod.coop/essglobal/2.1/standard/base-membership-type/BMT30,,,,,,Transport,Transportation and Storage,49320,Workers,Society,,,England,,Live,4735,FCA,2020-09-30,,Horsham Taxi Co-operative Limited,
R030789,Venture Folk,"VentureFolk Ltd. is a workers cooperative, owned and managed by a collective of innovators, creators and doers. It exists to facilitate collaborative action and new venture creation, while cultivating a community of problem solvers that produce sustainable solutions.

We tackle problems where the solutions can make a real social, economic and environmental impact. We do this by providing innovation as a service, by launching our own commercial spinouts or developing joint ventures with like-minded partners and organisations.

Our ability to curate skills and assemble expertise is what brings strength and power to our service offering. Built into Venture Folk is agility and resilience. We have a global network of contributors and we use the UN Sustainability Goals as our guide when deciding what challenges to tackle and what partners to engage.",https://dev.lod.coop/essglobal/2.1/standard/organisational-structure/OS130,https://dev.lod.coop/essglobal/2.1/standard/activities-ica/ICA280,,"Blick Shared Studios
51 Malone Road",Belfast,Belfast,BT9 6RY,GB,,http://www.venturefolk.co.uk,,,,,,,https://dev.lod.coop/essglobal/2.1/standard/base-membership-type/BMT30,,,,,,"Digital, Media and Communication",Information and Communication,63990,Workers,Society,,,Northern Ireland,,Live,4722,FCA,2020-08-26,,Venture Folk Limited,
R015146,Mike Stoane Lighting,"Mike Stoane Lighting was founded in 1995, when Mike started making lights on a lathe in his lock-up in Edinburgh. We have outgrown the lock-up now, but our lights are still made by us, in Scotland. This ensures excellent quality and flexibility and is something we are very proud of.",https://dev.lod.coop/essglobal/2.1/standard/organisational-structure/OS50,https://dev.lod.coop/essglobal/2.1/standard/activities-ica/ICA90,,"20 Dryden Road 
Bilston Glen Industrial Estate",Loanhead,Midlothian,EH20 9LZ,GB,,http://www.mikestoanelighting.com/,,,,,SC188910,,https://dev.lod.coop/essglobal/2.1/standard/base-membership-type/BMT30,,,,,,Manufacturing,Manufacturing,27400,Workers,Company,,,Scotland,,Live,SC188910,Companies House,1998-09-01,,Mike Stoane Lighting Ltd.,
R032392,Earthed Up!,"Earthed Up! is a workers co-operative growing edible and useful plants. Our aims are to increase food resilience, to encourage soil regeneration and carbon capture, by making perennial food plants easily available. We work within the ethics of earth care, people care and fair shares.",https://dev.lod.coop/essglobal/2.1/standard/organisational-structure/OS130,https://dev.lod.coop/essglobal/2.1/standard/activities-ica/ICA10,,"3 Haddon Close
Bullbridge",Belper,Derbyshire,DE56 2FG,GB,,https://earthedup.com/,,,,,,,https://dev.lod.coop/essglobal/2.1/standard/base-membership-type/BMT30,,,,,,Agriculture,"Agriculture, Forestry and Fishing",01300,Workers,Society,,,England,,Live,4797,FCA,2021-04-23,,Earthed Up! Limited,
R019779,Harcourt Pre-school,"Harcourt Pre-School aims to be an inclusive community where all families are welcome and children feel safe and secure.

Children have fun, learning and playing together with supportive adults who respond to children's individual interests and needs.
We continually evaluate and improve the service we provide.",https://dev.lod.coop/essglobal/2.1/standard/organisational-structure/OS50,https://dev.lod.coop/essglobal/2.1/standard/activities-ica/ICA270,,"Wells Room
St Albans Church
Bayswater Avenue
Westbury Park",Bristol,"Bristol, City of",BS6 7NU,GB,,http://www.harcourtpreschool.org.uk/,,,,,10195179,,https://dev.lod.coop/essglobal/2.1/standard/base-membership-type/BMT30,,,,,,Education,Education,85100,Workers,Company,,,England,,Live,10195179,Companies House,2016-05-23,,Harcourt Pre-school Ltd,
R020914,Grass Roots Remedies Co-operative,"We are an Edinburgh based workers’ cooperative whose central philosophy is that herbal medicine is the medicine of the people and should be accessible to everyone.

We offer a series of practical courses and workshops, run the low cost Community Herbal Medicine Clinic in Wester Hailes and produce simple resources to enable folks to practice herbalism at home.",https://dev.lod.coop/essglobal/2.1/standard/organisational-structure/OS50,https://dev.lod.coop/essglobal/2.1/standard/activities-ica/ICA270,,79 Crewe Crescent,Edinburgh,City of Edinburgh,EH5 2JN,GB,,http://www.grassrootsremedies.co.uk,,,,,SC525407,,https://dev.lod.coop/essglobal/2.1/standard/base-membership-type/BMT30,,,,,,Health and Social Care,Human Health and Social Work,86900,Workers,Company,,,Scotland,,Live,SC525407,Companies House,2016-01-28,,Grass Roots Remedies Co-operative Limited,
R035383,Forus Tree,"Forus Tree are a worker's co-operative, a not-for-profit social enterprise with a focus on managing the environment in the Calder Valley and beyond. Our aim is to mitigate climate change and restore biodiversity through planting, managing and protecting woodland and wildflower.",https://dev.lod.coop/essglobal/2.1/standard/organisational-structure/OS50,,,17 Joshua Street,Todmorden,Calderdale,OL14 5EF,GB,,http://www.forustree.org,,,,,12413476,,https://dev.lod.coop/essglobal/2.1/standard/base-membership-type/BMT30,,,,,,Agriculture,,,Workers,Company,,,England,,Live,12413476,Companies House,2020-01-20,,Forus Tree,
R022552,The Contractor Co-operative,"The Contractor Co-operative is the first and only employee owned co-operative for the contracting community.

Being wholly owned and controlled by the members it serves, all decisions are taken as a collective for the benefit of the Co-operative, its members and nobody else. Typically, contractors will work for their end clients under either an umbrella arrangement or through their own limited company. Both options carry risks and responsibilities.

By joining The Contractor Co-operative, all the worries of operating alone or under an umbrella organisation are removed. Members will have access to professional and expert advice, have a say in their working arrangements and share the financial success of the business in proportion to the fees they generate.

If you are currently contracting, or considering getting into contracting you should contact us now - Call 020 3468 0009",https://dev.lod.coop/essglobal/2.1/standard/organisational-structure/OS50,https://dev.lod.coop/essglobal/2.1/standard/activities-ica/ICA120,,40 Queen St,London,City of London,EC4R 1DD,GB,,https://www.contractor.coop/,,,,,11070685,,https://dev.lod.coop/essglobal/2.1/standard/base-membership-type/BMT30,,,,,,Other,Other Service Activities,96090,Workers,Company,,,England,,Live,11070685,Companies House,2017-11-17,,The Contractor Co-operative Limited,
R015132,G53 Co-operative Society,"G53 Co-operative Healthcare operates as an agency providing skilled healthcare professionals.

Long and short-term staff are available depending on requirements.",https://dev.lod.coop/essglobal/2.1/standard/organisational-structure/OS130,https://dev.lod.coop/essglobal/2.1/standard/activities-ica/ICA110,,"Unit 22
City Works
Alfred Street",Gloucester,Gloucestershire,GL1 4DF,GB,,https://g53healthcare.co.uk/about/,,,,,,,https://dev.lod.coop/essglobal/2.1/standard/base-membership-type/BMT30,,,,,,Professional and Legal services,"Professional, Scientific and Technical",71112,Workers,Society,,,England,,Live,4090,FCA,2015-10-02,,G53 Co-operative Society Limited,
R033170,Rebel Cities Media,Rebel Cities Media is working to develop a more impactful and flourishing media to achieve greater democracy in society,https://dev.lod.coop/essglobal/2.1/standard/organisational-structure/OS130,https://dev.lod.coop/essglobal/2.1/standard/activities-ica/ICA280,,12 Kimberley Street,Stoke-on-Trent,Stoke-on-Trent,ST3 2QY,GB,,http://www.facebook.com/rebelcities,,,,,,,https://dev.lod.coop/essglobal/2.1/standard/base-membership-type/BMT30,,,,,,"Digital, Media and Communication",Information and Communication,63990,Workers,Society,,,England,,Live,4813,FCA,2021-06-18,,Rebel Cities Media Limited,
R036892,Antithesis Research,Family-run sustainable investment research business,https://dev.lod.coop/essglobal/2.1/standard/organisational-structure/OS50,https://dev.lod.coop/essglobal/2.1/standard/activities-ica/ICA120,,"Tudor Meade
Newport Road
Niton",Ventnor,Isle of Wight,PO38 2DF,GB,,,,,,,14466016,,https://dev.lod.coop/essglobal/2.1/standard/base-membership-type/BMT30,,,,,,Other,Administrative and Support Services,82990,Workers,Company,,,England,,Live,14466016,Companies House,2022-11-07,,Antithesis Research Limited,
R036893,Dudden,"Dudden Ltd is a west country based sustainable management practice working across the UK and internationally to bring industry and business towards a more sustainable future. Born from an industrial and construction background, Dudden Ltd realises that now more than ever organisations need to operate in Economic, Social and an Environmentally sustainable way, and brings its cross-functional experience to achieve this. We utilise internationally developed standards enabling our clients to gain certification, add value and increase transparency of their business and products.",https://dev.lod.coop/essglobal/2.1/standard/organisational-structure/OS130,https://dev.lod.coop/essglobal/2.1/standard/activities-ica/ICA110,,"2 Burton Cross
East Coker",Yeovil,Somerset,BA22 9LY,GB,,http://www.dudden.co.uk,,,,,,,https://dev.lod.coop/essglobal/2.1/standard/base-membership-type/BMT30,,,,,,Professional and Legal services,"Professional, Scientific and Technical",74901,Workers,Society,,,England,,Live,4978,FCA,2022-10-17,,Dudden Limited,
R014881,The Kent Coppice Workers' Co-operative,It is being set up by the request of coppice woodland workers in Kent to enable them to work more effectively together and to facilitate communication and sharing of experience between them,https://dev.lod.coop/essglobal/2.1/standard/organisational-structure/OS130,https://dev.lod.coop/essglobal/2.1/standard/activities-ica/ICA280,,"c/o Esus Forestry - Training
Tyto Alba, The Meads",Cranbrook,Kent,TN17 3QB,GB,,,,,,,,,https://dev.lod.coop/essglobal/2.1/standard/base-membership-type/BMT30,,,,,,"Membership associations, social clubs and trade unions",Other Service Activities,94120,Workers,Society,,,England,,Live,4037,FCA,2015-02-09,,The Kent Coppice Workers' Co-operative Limited,
R032588,Preston Cooperative Education Centre,"The Preston Cooperative Education Centre (PCEC) was founded in 2021 as a union-coop. We are passionate about education, democracy and co-operation. As a union-coop, we will be governed by our members: worker owners, staff and students. We will provide education and training in co-operatives and co-operation. In the PCEC everyone is a teacher and a learner. Our courses will meet the needs of our students, and will lead to a regeneration of democratic and co-operative ways of working for Preston and beyond. Our work in common will support people to create new co-operative businesses within a co-operative framework of community wealth building. We offer an alternative to standard business approaches. We believe in making the profits of our work benefit other co-operatives and local communities for the common good.",https://dev.lod.coop/essglobal/2.1/standard/organisational-structure/OS130,https://dev.lod.coop/essglobal/2.1/standard/activities-ica/ICA270,,103 Church Street,Preston,Lancashire,PR1 3BS,GB,,https://prestoncoopeducationcentre.org,,,,,,,https://dev.lod.coop/essglobal/2.1/standard/base-membership-type/BMT30,,,,,,Education,Education,85590,Workers,Society,,,England,,Live,4801,FCA,2021-05-24,,Preston Cooperative Education Centre Limited,
R025501,Fair Trademark Co-operative,Registering Trademarks and Intellectual Property.,https://dev.lod.coop/essglobal/2.1/standard/organisational-structure/OS130,https://dev.lod.coop/essglobal/2.1/standard/activities-ica/ICA110,,"c/o Whitnalls Accountants
Cotton House, Old Hall Street",Liverpool,Liverpool,L15 2HS,GB,,http://www.fairtrademark.co.uk,,,,,,,https://dev.lod.coop/essglobal/2.1/standard/base-membership-type/BMT30,,,,,,Professional and Legal services,"Professional, Scientific and Technical",74000,Workers,Society,,,England,,Live,4552,FCA,2018-12-21,,Fair Trademark Limited,
R027143,York Collective,"Worker owned bicycle co-operative. An ethical, environmentally friendly and convenient courier service.",https://dev.lod.coop/essglobal/2.1/standard/organisational-structure/OS50,https://dev.lod.coop/essglobal/2.1/standard/activities-ica/ICA220,,20 Abbotsway,York,York,YO31 9LF,GB,,http://www.yorkcollective.co.uk,,,,,12422006,,https://dev.lod.coop/essglobal/2.1/standard/base-membership-type/BMT30,,,,,,Transport,Transportation and Storage,49410,Workers,Company,,,England,,Live,12422006,Companies House,2020-01-23,,York Collective Ltd,
R034145,Artefact Stirchley,"Artefact is an artist-led, community-focused arts space, in Stirchley, South Birmingham.",https://dev.lod.coop/essglobal/2.1/standard/organisational-structure/OS50,https://dev.lod.coop/essglobal/2.1/standard/activities-ica/ICA280,,"1464 Pershore Road
Stirchley",Birmingham,Birmingham,B30 2NT,GB,,http://www.artefactstirchley.co.uk,,,,,10632691,,https://dev.lod.coop/essglobal/2.1/standard/base-membership-type/BMT30,,,,,,Arts and Culture,"Arts, Entertainment and Recreation",90040,Workers,Company,,,England,,Live,10632691,Companies House,2017-02-22,,Artefact (Stirchley) Ltd,
R034131,Biomagnetic Pair Training UK,"Biomagnetic pairs is a complementary therapy, a form of biomagnetism. Taking a whole-body approach, it aims to restore health and promote wellness. It does this through the identification and rebalancing of magnetic disturbances in the body by targeted use of both magnetic poles.  Many conditions can be treated , including chronic, autoimmune and degenerative.",https://dev.lod.coop/essglobal/2.1/standard/organisational-structure/OS50,https://dev.lod.coop/essglobal/2.1/standard/activities-ica/ICA270,,4 Latimer Street,Romsey,Hampshire,SO51 8DG,GB,,http://www.biomagnetismpairs.co.uk,,,,,13541226,,https://dev.lod.coop/essglobal/2.1/standard/base-membership-type/BMT30,,,,,,Education,Education,85590,Workers,Company,,,England,,Live,13541226,Companies House,2021-07-30,,Biomagnetic Pair Training UK Limited,
R034196,MYCO Manchester Mushroom,"Five people with a love affair for fungi, focused on building a more just food system.

Pilot urban farm in Manchester, growing oyster mushrooms.",https://dev.lod.coop/essglobal/2.1/standard/organisational-structure/OS50,,,1396 Ashton Old Road,Manchester,Manchester,M11 1JX,GB,,http://linktr.ee/mycomanchester,,,,,13068762,,https://dev.lod.coop/essglobal/2.1/standard/base-membership-type/BMT30,,,,,,Agriculture,,,Workers,Company,,,England,,Live,13068762,Companies House,2020-12-07,,MYCO Manchester Mushroom Ltd,
