Identifier,Name,Description,Organisational Structure,Primary Activity,Activities,Street Address,Locality,Region,Postcode,Country ID,Territory ID,Website,Phone,Email,Twitter,Facebook,Companies House Number,Qualifiers,Membership Type,Latitude,Longitude,Geo Container,Geo Container Latitude,Geo Container Longitude,Sector,SIC Section,SIC Code,Ownership Classification,Legal Form,Legal Form Subcategory 1,Legal Form Subcategory 1,UK Nation,Type of Organisation,Registered Status,Registered Number,Registrar,Incorporation Date,Dissolved Date,Organisation Name,WC Legal Form
R005299,The Poetry Business,"The Poetry Business is a poetry publisher and writer development agency.

We publish books, pamphlets, audio and eBooks under the smith|doorstop imprint; edit a literary magazine, The North; and run Writing Days, masterclasses, residential courses, and a Writing School for published poets. We also run the annual Book & Pamphlet Competition. 

Our poets have won or been shortlisted for almost every major poetry prize, including the Forward Prize on 11 occasions and 10 Poetry Book Society awards, and smith|doorstop Books was awarded the 2012 Michael Marks Award. Andrew Motion described The Poetry Business as ""one of the most vital and vitalising literary organisations in the country"".",https://dev.lod.coop/essglobal/2.1/standard/organisational-structure/OS50,https://dev.lod.coop/essglobal/2.1/standard/activities-ica/ICA280,,"Campo House
54 Campo Lane",Sheffield,Sheffield,S1 2EG,GB,,http://www.poetrybusiness.co.uk/,,,,,02644139,,https://dev.lod.coop/essglobal/2.1/standard/base-membership-type/BMT30,,,,,,"Digital, Media and Communication",Information and Communication,58110,Workers,Company,,,England,,Live,02644139,Companies House,1991-09-09,,The Poetry Business Ltd,
R005300,Visual Production Services,,https://dev.lod.coop/essglobal/2.1/standard/organisational-structure/OS50,https://dev.lod.coop/essglobal/2.1/standard/activities-ica/ICA280,,128 Carlton Road,Nottingham,Nottingham,NG3 2BB,GB,,,,,,,02362324,,https://dev.lod.coop/essglobal/2.1/standard/base-membership-type/BMT30,,,,,,Arts and Culture,"Arts, Entertainment and Recreation",90030,Workers,Company,,,England,,Live,02362324,Companies House,1989-03-16,,Visual Production Services Limited,
R005306,Chinese Marketing and Communications,,https://dev.lod.coop/essglobal/2.1/standard/organisational-structure/OS50,https://dev.lod.coop/essglobal/2.1/standard/activities-ica/ICA120,,"Uwchlawr Coed
Gellilydan",Blaenau Ffestiniog,Gwynedd,LL41 4EY,GB,,http://www.china-britain.org/china_services/chinese_translation_manchester.htm,,,,,01978777,,https://dev.lod.coop/essglobal/2.1/standard/base-membership-type/BMT30,,,,,,Other,Other Service Activities,96090,Workers,Company,,,Wales,,Live,01978777,Companies House,1986-01-16,,Chinese Information Centre Co-operative Limited,
R005311,Metal Polishing Co-operative,,https://dev.lod.coop/essglobal/2.1/standard/organisational-structure/OS50,https://dev.lod.coop/essglobal/2.1/standard/activities-ica/ICA90,,"Unit 5 - Chancel Industrial Estate
Hickman Avenue",Wolverhampton,Wolverhampton,WV1 2UH,GB,,,,,,,02081216,,https://dev.lod.coop/essglobal/2.1/standard/base-membership-type/BMT30,,,,,,Manufacturing,Manufacturing,25990,Workers,Company,,,England,,Live,02081216,Companies House,1986-12-05,,Metal Polishing Co-operative Limited,
R005323,El Vergel,"A worker co-operative run restaurant and catering business.

Authentic Latin American and Mediterranean food, freshly made with a friendly service

We pride ourselves on the quality of our ingredients, carefully chosen at London’s early morning markets: the meat and poultry must be fresh and tender, the fruit and vegetables sweet and crisp. Everything on the menu is prepared and cooked in our own kitchen.",https://dev.lod.coop/essglobal/2.1/standard/organisational-structure/OS50,https://dev.lod.coop/essglobal/2.1/standard/activities-ica/ICA120,,132 Webber Street,London,Southwark,SE1 0QL,GB,,http://www.elvergel.co.uk,,,,,02260790,,https://dev.lod.coop/essglobal/2.1/standard/base-membership-type/BMT30,,,,,,"Food service, Accommodation and Pubs",Accommodation and Food Services,56290,Workers,Company,,,England,,Live,02260790,Companies House,1988-05-20,,El Vergel Ltd,
R005324,Village Roots (Frampton),,https://dev.lod.coop/essglobal/2.1/standard/organisational-structure/OS50,https://dev.lod.coop/essglobal/2.1/standard/activities-ica/ICA210,,"Units 1-4 Crossley Farm Business Centre
Swan Lake
Winterbourne",Bristol,South Gloucestershire,BS36 1RH,GB,,,,,,,02365170,,https://dev.lod.coop/essglobal/2.1/standard/base-membership-type/BMT30,,,,,,Housing,Real Estate,68209,Workers,Company,,,England,,Live,02365170,Companies House,1989-03-23,,Village Roots (Frampton) Limited,
R005354,Brightkidz,"Brandmythingy.com provides a wide range of promotional products and corporate gifts. All the profits go to support Brightkidz which  promotes walking, cycling and road safety awareness for children. Brandmythingy.com and Brightkidz are trading names of Safe Kids Walking Ltd a social enterprise and worker co-operative.",https://dev.lod.coop/essglobal/2.1/standard/organisational-structure/OS50,https://dev.lod.coop/essglobal/2.1/standard/activities-ica/ICA260,,"Unit 15 The Business Exchange
Rockingham Road",Kettering,Northamptonshire,NN16 8JX,GB,,http://www.brightkidz.co.uk,,,,,05069325,,https://dev.lod.coop/essglobal/2.1/standard/base-membership-type/BMT30,,,,,,Retail,Wholesale and Retail; Vehicle Repair,47910,Workers,Company,,,England,,Live,05069325,Companies House,2004-03-10,,Safe Kids Walking Ltd,
R006084,Media Co-op,"Film, animation, web, apps, social media – media co-op is an award-winning social enterprise that works with the third and public sectors, specialising in participation and co-design.",https://dev.lod.coop/essglobal/2.1/standard/organisational-structure/OS50,https://dev.lod.coop/essglobal/2.1/standard/activities-ica/ICA280,,"406 White Studios
62 Templeton Street",Glasgow,"Glasgow, City of",G40 1DA,GB,,http://www.mediaco-op.net,,,,,SC277277,,https://dev.lod.coop/essglobal/2.1/standard/base-membership-type/BMT30,,,,,,"Digital, Media and Communication",Information and Communication,59112,Workers,Company,,,Scotland,,Live,SC277277,Companies House,2004-12-09,,Social Change Productions Ltd.,
R003792,Jack Drum Arts,"Jack Drum Arts is a professional artists' co-operative which brings together practitioners from different creative disciplines to work together on a wide range of projects.  Together, company members create theatre performances, films, exhibitions, intallations and events inspired by the past, present and the future.  Participatory work with education and community groups is a key component of the company's work, enabling target audiences to influence the look and feel of a piece as well as stimulating them to develop their own creative abilities.",https://dev.lod.coop/essglobal/2.1/standard/organisational-structure/OS120,https://dev.lod.coop/essglobal/2.1/standard/activities-ica/ICA280,,"The St Cuthberts Centre
Church Hill",Crook,County Durham,DL15 9DN,GB,,http://www.jackdrum.co.uk,,,,,03428595,,https://dev.lod.coop/essglobal/2.1/standard/base-membership-type/BMT30,,,,,,Sports and Recreation,"Arts, Entertainment and Recreation",93290,Workers,Community Interest Company,,,England,,Live,03428595,Companies House,1997-09-03,,Jack Drum Arts C.I.C.,
R004020,Avenue Community Nursing Home,A workers co-operative.,https://dev.lod.coop/essglobal/2.1/standard/organisational-structure/OS50,https://dev.lod.coop/essglobal/2.1/standard/activities-ica/ICA270,,"47 The Avenue
Linthorpe",Middlesbrough,Middlesbrough,TS5 6PE,GB,,,,,,,01916601,,https://dev.lod.coop/essglobal/2.1/standard/base-membership-type/BMT30,,,,,,Health and Social Care,Human Health and Social Work,86102,Workers,Company,,,England,,Live,01916601,Companies House,1985-05-24,,Avenue Community Nursing Home Limited,
R006320,Co-ownership Solutions,We help organisations who wish to become co-owned by their employees and/or members as a result of a business succession scenario. The result might a co-op or employee owned company through and EBT. We also work with existing co-owned organisations to help them develop their ownership culture.,https://dev.lod.coop/essglobal/2.1/standard/organisational-structure/OS115,https://dev.lod.coop/essglobal/2.1/standard/activities-ica/ICA110,,8-10 South Street,Epsom,Surrey,KT18 7PF,GB,,http://www.coownershipsolutions.co.uk,,,,,OC363695,,https://dev.lod.coop/essglobal/2.1/standard/base-membership-type/BMT30,,,,,,Professional and Legal services,"Professional, Scientific and Technical",70220,Workers,LLP,,,England,,Live,OC363695,Companies House,2011-04-11,,Co-ownership Solutions LLP,
R006342,Wharf Chambers,"The co-op's objective is to establish and run an ethical, affordable and sustainable city-centre venue in Leeds with multiple uses. In the daytime there will be a cafe and a community workshop space, and in the evening a members' club will open a bar and host live and pre-recorded music events. In conjunction with the members' club we aim to provide a flexible space for art, film, music, politics and discussion that brings together people from communities across Leeds. We hope to foster and develop experimental and non-market-led music and cultural activity in the city.",https://dev.lod.coop/essglobal/2.1/standard/organisational-structure/OS130,https://dev.lod.coop/essglobal/2.1/standard/activities-ica/ICA280,,"Wharf Chambers
23 Wharf Street",Leeds,Leeds,LS2 7EQ,GB,,http://www.wharfchambers.org,,,,,,,https://dev.lod.coop/essglobal/2.1/standard/base-membership-type/BMT30,,,,,,Arts and Culture,"Arts, Entertainment and Recreation",90040,Workers,Society,,,England,,Live,31273R,FCA,2011-06-02,,Wharf Chambers Limited,
R006361,Sixteen,A worker co-op of job coaches to support disabled people into employment.,https://dev.lod.coop/essglobal/2.1/standard/organisational-structure/OS50,https://dev.lod.coop/essglobal/2.1/standard/activities-ica/ICA120,,"Filwood Green Business Park
Filwood Park Lane",Bristol,"Bristol, City of",BS4 1ET,GB,,http://www.sixteencoop.co.uk,,,,,07672446,,https://dev.lod.coop/essglobal/2.1/standard/base-membership-type/BMT30,,,,,,Other,Administrative and Support Services,78109,Workers,Company,,,England,,Live,07672446,Companies House,2011-06-16,,Sixteen Co-operative Ltd,
R006602,Wood Fuel Co-operative,"The Wood Fuel Co-operative supplies firewood logs, wood briquettes, wood pellets, kindling and firelighters to members throughout the UK.

Why not join us? By combining your financial fire-power with other like-minded individuals we are able to lever some amazing discounts from brand name suppliers.",https://dev.lod.coop/essglobal/2.1/standard/organisational-structure/OS50,https://dev.lod.coop/essglobal/2.1/standard/activities-ica/ICA260,,Heathhall Industrial Estate,Dumfries,Dumfries and Galloway,DG1 3PH,GB,,http://www.woodfuel.coop,,,,,SC399132,,https://dev.lod.coop/essglobal/2.1/standard/base-membership-type/BMT30,,,,,,Retail,Wholesale and Retail; Vehicle Repair,47990,Workers,Company,,,Scotland,,Live,SC399132,Companies House,2011-05-09,,Wood Fuel Co-operative,
R006375,The Cycling Partnership,"The Cycling Partnership is a cooperative of experienced and well qualified Cycle Instructors working in Exeter, Newton Abbot, Tiverton and surrounding areas. 

The co-op delivers nationally funded Bikeability courses to nearly all primary schools across the area and an increasing number of senior schools. Bikeability is known as 'Cycling Proficiency for the 21st Century.' 

Also available are Adult Training sessions, ranging from Learn to Ride through Road Awareness to Commuter Route Planning, and sessions for younger children, including Balanceability and Learn to Ride.

The Cycling Partnership has been set up to promote cycling in a safe and healthy way to all ages, providing training at all levels for the benefit of people and communities by reduction of road congestion and pollution.",https://dev.lod.coop/essglobal/2.1/standard/organisational-structure/OS115,https://dev.lod.coop/essglobal/2.1/standard/activities-ica/ICA280,,"The Lodge Green End Lane
Plymtree",Cullompton,Devon,EX15 2JR,GB,,http://www.thecyclingpartnership.co.uk,,,,,OC366070,,https://dev.lod.coop/essglobal/2.1/standard/base-membership-type/BMT30,,,,,,"Membership associations, social clubs and trade unions",Other Service Activities,94990,Workers,LLP,,,England,,Live,OC366070,Companies House,2011-06-29,,The Cycling Partnership LLP,
R006620,Oxford Greenprint,"Oxford GreenPrint is a workers' co-op which provides ethical, low impact printing to community groups, campaign groups, NGOs and businesses. We also offer a range of other services, including design, proof reading, sales of paper, comb-binding and lamination.",https://dev.lod.coop/essglobal/2.1/standard/organisational-structure/OS50,https://dev.lod.coop/essglobal/2.1/standard/activities-ica/ICA280,,"Room 1/OARC
East Oxford Community Centre
Princes Street",Oxford,Oxfordshire,OX4 1DD,GB,,http://www.oxfordgreenprint.com,,,,,03324495,,https://dev.lod.coop/essglobal/2.1/standard/base-membership-type/BMT30,,,,,,"Digital, Media and Communication",Information and Communication,58190,Workers,Company,,,England,,Live,03324495,Companies House,1997-02-26,,Oxford Greenprint Limited,
R006377,Greasby Pre-School Playgroup,"Pre-School playgroup based at the Greasby Methodist Church Hall, Pickerill Road.

Greasby Pre-School Playgroup is run by a co-operative management scheme. It opened in 1964 and operates from the main church hall and a smaller room within Greasby Methodist Church, Greasby, Wirral.

A maximum of 35 children may attend the playgroup at any one time.",https://dev.lod.coop/essglobal/2.1/standard/organisational-structure/OS50,https://dev.lod.coop/essglobal/2.1/standard/activities-ica/ICA270,,21 Halton Crescent,Greasby,Wirral,CH49 3PG,GB,,,,,,,07696153,,https://dev.lod.coop/essglobal/2.1/standard/base-membership-type/BMT30,,,,,,Education,Education,85100,Workers,Company,,,England,,Live,07696153,Companies House,2011-07-07,,Greasby Pre-School Playgroup Limited,
R006394,Webarchitects,"Webarchitects is an ethically based multi-stakeholder Internet services co-operative.

Webarchitects run all the usual hosting services like shared web servers, virtual machines and co-location. However, despite the name, Webarchitects do a lot more than just design web-based services. Webarchitects provide everything necessary for their customers' Internet operations. The organization designs, builds and operates Internet infrastructure in the UK and Iceland.",https://dev.lod.coop/essglobal/2.1/standard/organisational-structure/OS130,https://dev.lod.coop/essglobal/2.1/standard/activities-ica/ICA280,,"Unit 12 Harland Works
68a John Street",Sheffield,Sheffield,S2 4QU,GB,,http://www.webarchitects.coop,,,,,,,https://dev.lod.coop/essglobal/2.1/standard/base-membership-type/BMT30,,,,,,"Digital, Media and Communication",Information and Communication,62020,Workers,Society,,,England,,Live,31305R,FCA,2011-07-07,,Webarch Co-operative Limited,
R006635,Roydon Pre-School,Childcare,https://dev.lod.coop/essglobal/2.1/standard/organisational-structure/OS50,https://dev.lod.coop/essglobal/2.1/standard/activities-ica/ICA270,,43 Church Close,Roydon,Norfolk,IP22 5RQ,GB,,http://www.roydonearlyyears.weebly.com,,,,,07785659,,https://dev.lod.coop/essglobal/2.1/standard/base-membership-type/BMT30,,,,,,Health and Social Care,Human Health and Social Work,88910,Workers,Company,,,England,,Live,07785659,Companies House,2011-09-23,,Roydon Early Years Ltd,
R006613,Paringdon Education & Training,,https://dev.lod.coop/essglobal/2.1/standard/organisational-structure/OS50,https://dev.lod.coop/essglobal/2.1/standard/activities-ica/ICA270,,"Paringdon Sports club
Paringdon Road",Harlow,Essex,CM19 4QT,GB,,,,,,,07757692,,https://dev.lod.coop/essglobal/2.1/standard/base-membership-type/BMT30,,,,,,Education,Education,85600,Workers,Company,,,England,,Live,07757692,Companies House,2011-08-31,,Paringdon Education & Training Ltd,
R007126,Co-operative Wealth,Co-operative Wealth is a workers co-operative which means it is owned by the workers to create a fair co-operative advice business. We are members of Co-operative UK who are the national trade body for the co-operatives in all sectors.,https://dev.lod.coop/essglobal/2.1/standard/organisational-structure/OS50,https://dev.lod.coop/essglobal/2.1/standard/activities-ica/ICA140,,"11 Mallard Way
Pride Park",Derby,Derby,DE24 8GX,GB,,http://www.wealth.coop,,,,,08049376,,https://dev.lod.coop/essglobal/2.1/standard/base-membership-type/BMT30,,,,,,Finance,Financial and Insurance,64999,Workers,Company,,,England,,Live,08049376,Companies House,2012-04-27,,Co-operative Independent Financial Solutions Ltd,
R008919,Bridgefoot Organic Co-operative,Fresh organic vegetables selected according to your personal preferences and delivered to your door.,https://dev.lod.coop/essglobal/2.1/standard/organisational-structure/OS130,https://dev.lod.coop/essglobal/2.1/standard/activities-ica/ICA10,,Bridgefoot Organic Farm,Newmachar,Aberdeenshire,AB21 7PE,GB,,http://www.bridgefootorganics.co.uk,,,,,,,https://dev.lod.coop/essglobal/2.1/standard/base-membership-type/BMT30,,,,,,Agriculture,"Agriculture, Forestry and Fishing",01130,Workers,Society,,,Scotland,,Live,2768RS,FCA,2013-05-02,,Bridgefoot Organic Co-operative Limited,
R008926,Valley Organics Workers Co-op,"In the spring of 2013, the owners of Valley Organics decided to sell their business. The four shop workers plus two others put together their savings, with help from friends and relatives. We issued loan stock for more funding, and with help from Co-operatives UK and a loan from ICOF, we bought the business and established a Workers' Co-op.

The shop has continued to thrive and promote eating and growing good local food. We now open longer hours and have two workers in the shop at all times.",https://dev.lod.coop/essglobal/2.1/standard/organisational-structure/OS130,https://dev.lod.coop/essglobal/2.1/standard/activities-ica/ICA260,,31 Market Street,Hebden Bridge,Calderdale,HX7 6EU,GB,,https://valleyorganics.coop/,,,,,,,https://dev.lod.coop/essglobal/2.1/standard/base-membership-type/BMT30,,,,,,Retail,Wholesale and Retail; Vehicle Repair,47210,Workers,Society,,,England,,Live,32061R,FCA,2013-05-07,,Valley Organics Workers Co-op Limited,
R008928,Bishopston Beanstalks,"We are a new pre-school with a 'Good' Ofsted rating, handily located on Gloucester Road in Bishopston, North Bristol.  We are close to many local primary schools, including Bishop Road, Ashley Down, Sefton Park, St Bonaventure’s and Brunel Fields. Bishopston Beanstalks is run by its staff team as a not-for-profit, independent, workers’ co-operative. We provide a stimulating, homely environment within the premises of Bishopston Methodist Church, and place an emphasis on learning through play.",https://dev.lod.coop/essglobal/2.1/standard/organisational-structure/OS50,https://dev.lod.coop/essglobal/2.1/standard/activities-ica/ICA270,,"Bishopton Methodist Church
245 Gloucester Road
Bishopston",Bristol,"Bristol, City of",BS7 8NY,GB,,http://www.bishopstonbeanstalks.co.uk/,,,,,08556138,,https://dev.lod.coop/essglobal/2.1/standard/base-membership-type/BMT30,,,,,,Education,Education,85100,Workers,Company,,,England,,Live,08556138,Companies House,2013-06-04,,Bishopston Beanstalks Ltd,
R007148,Farnham Community Farm,"Founded in 2008, Farnham Local Food is a community-run local agriculture project supported almost entirely by volunteer labour.  We currently have land at Runfold and Dippenhall.  Our aim is to provide fresh, locally grown vegetables for people in and around the Farnham, Surrey, England area.

The project was started because it was felt that there was a need and a niche for the kind of lifestyle that maintained a healthier attitude towards fresh produce and the production behind it.",https://dev.lod.coop/essglobal/2.1/standard/organisational-structure/OS130,https://dev.lod.coop/essglobal/2.1/standard/activities-ica/ICA260,,12 Three Stiles Road,Farnham,Surrey,GU9 7DE,GB,,http://www.farnhamfood.com,,,,,,,https://dev.lod.coop/essglobal/2.1/standard/base-membership-type/BMT30,,,,,,Retail,Wholesale and Retail; Vehicle Repair,47210,Workers,Society,,,England,,Live,31706R,FCA,2012-08-16,,Farnham Community Farm Limited,
R007674,Morningside Nursery,The Morningside Children's Nursery was established in 1998 as a workers co-operative and provides full day care.,https://dev.lod.coop/essglobal/2.1/standard/organisational-structure/OS50,https://dev.lod.coop/essglobal/2.1/standard/activities-ica/ICA270,,1a Nile Grove,Edinburgh,City of Edinburgh,EH10 4RE,GB,,,,,,,SC386418,,https://dev.lod.coop/essglobal/2.1/standard/base-membership-type/BMT30,,,,,,Education,Education,85100,Workers,Company,,,Scotland,,Live,SC386418,Companies House,2010-10-04,,Morningside Children's Nursery Ltd,
R008932,The Coppice Co-op,"We are a co-operative of coppice workers based in the North Lancashire/South Cumbrian region of Britain, working towards sustainable woodland management. We supply local firewood, charcoal and a wide range of traditional products. We run craft and coppice courses from our beautiful woodland yard.",https://dev.lod.coop/essglobal/2.1/standard/organisational-structure/OS130,https://dev.lod.coop/essglobal/2.1/standard/activities-ica/ICA30,,"Crag View
Dixon's Field
Crag Bank",Carnforth,Lancashire,LA5 9JN,GB,,http://www.coppicecoop.co.uk,,,,,,,https://dev.lod.coop/essglobal/2.1/standard/base-membership-type/BMT30,,,,,,Agriculture,"Agriculture, Forestry and Fishing",02100,Workers,Society,,,England,,Live,32118R,FCA,2013-07-03,,The Coppice Co-op Limited,
R010064,STRIKE! Magazine,"STRIKE! is a bi-monthly newspaper – we deal in politics, philosophy, art, subversion and sedition. Each issue we gather together a group of high-grade artists and authors and let them get creative. It’s a magazine, it’s a journal, it’s a carnival.

STRIKE! is an independent publication. We will never sell any advertising, and we will always be strictly anti-profit.",https://dev.lod.coop/essglobal/2.1/standard/organisational-structure/OS50,https://dev.lod.coop/essglobal/2.1/standard/activities-ica/ICA280,,27 Old Gloucester Street,London,Camden,WC1N 3AX,GB,,http://strikemag.org/,,,,,09359954,,https://dev.lod.coop/essglobal/2.1/standard/base-membership-type/BMT30,,,,,,"Digital, Media and Communication",Information and Communication,58140,Workers,Company,,,England,,Live,09359954,Companies House,2014-12-18,,STRIKE! Magazine Ltd,
R007702,West Highland Free Press,"The community-based, and now employee-owned, West Highland Free Press was founded in 1972 with the principal objective of providing its immediate circulation area with all of the services expected from a local newspaper. Starting from humble beginnings on the Isle of Skye, the newspaper quickly gained a reputation for informed and outspoken news coverage. Building on that reputation, the Free Press firmly established itself as the newspaper of choice for many thousands of households across the West Highlands and Islands and further afield.

Freumhaichte sa choimhearsnachd, agus a-nis fo shealbh an luchd-obrach, chaidh Pàipear Beag an Eilein Sgitheanaich a stèidheachadh ann an 1972 leis a’ cheann-uidhe gach seirbheis a bhite a’ sùileachadh bho phàipear-naidheachd ionadail a thoirt do na sgìrean air am biodh e a’ frithealadh B’ ann air beag stèidh a thòisich cùisean, ach cha b’ fhada gus an do choisinn am pàipear cliù airson aithrisean fiosrach agus beachdail. A’ togail air a’ chliù seo, chaidh an fhèill a bh’ air a’ phàipear am meud agus na mìltean agus na mìltean de dhaoine bho air feadh Taobh Siar na Gàidhealtachd agus nan Eilean, agus bho iomadh ceàrnaidh eile thall ’s a-bhos, ga cheannach.",https://dev.lod.coop/essglobal/2.1/standard/organisational-structure/OS50,https://dev.lod.coop/essglobal/2.1/standard/activities-ica/ICA280,,"Unit 1B
Pairc Nan Craobh
Broadford",Isle of Skye,Highland,IV49 9AP,GB,,http://www.whfp.com,,,,,SC049850,,https://dev.lod.coop/essglobal/2.1/standard/base-membership-type/BMT30,,,,,,"Digital, Media and Communication",Information and Communication,58130,Workers,Company,,,Scotland,,Live,SC049850,Companies House,1972-01-24,,West Highland Publishing Company Limited,
R007704,Woollard And Henry,"Operating since 1873, we are proud to have a depth of experience and leading innovators in every of our key sectors.

Woollard & Henry - a customer-centric and people driven business.",https://dev.lod.coop/essglobal/2.1/standard/organisational-structure/OS50,https://dev.lod.coop/essglobal/2.1/standard/activities-ica/ICA90,,"Stoneywood Park
Dyce",Aberdeen,Aberdeen City,AB21 7DZ,GB,,http://www.woollardandhenry.com/,,,,,SC036131,,https://dev.lod.coop/essglobal/2.1/standard/base-membership-type/BMT30,,,,,,Manufacturing,Manufacturing,28950,Workers,Company,,,Scotland,,Live,SC036131,Companies House,1961-02-21,,Woollard & Henry Limited,
