Identifier,Name,Description,Organisational Structure,Primary Activity,Activities,Street Address,Locality,Region,Postcode,Country ID,Territory ID,Website,Phone,Email,Twitter,Facebook,Companies House Number,Qualifiers,Membership Type,Latitude,Longitude,Geo Container,Geo Container Latitude,Geo Container Longitude,Sector,SIC Section,SIC Code,Ownership Classification,Legal Form,Legal Form Subcategory 1,Legal Form Subcategory 1,UK Nation,Type of Organisation,Registered Status,Registered Number,Registrar,Incorporation Date,Dissolved Date,Organisation Name,WC Legal Form
R002200,Wild Things; Ecological Education Collective,"Wild Things is a not-for-profit workers co-operative providing environmental play and discovery based learning activities within Nottinghamshire. They have been established since 1996, developing from one or two activities to a whole programme of events. Wild Things work with groups aged between 5 years old and adults. The co-operative is common ownership which means if the project is dissolved it's assets are passed on to a project with similar aims not divided up between the members.",https://dev.lod.coop/essglobal/2.1/standard/organisational-structure/OS50,https://dev.lod.coop/essglobal/2.1/standard/activities-ica/ICA270,,70 Churchfield Lane,Nottingham,Nottingham,NG7 5QY,GB,,http://www.wildthings.org.uk,,,,,03677411,,https://dev.lod.coop/essglobal/2.1/standard/base-membership-type/BMT30,,,,,,Education,Education,85590,Workers,Company,,,England,,Live,03677411,Companies House,1998-12-02,,Wild Things; Ecological Education Collective Ltd.,
R001458,Metco,,https://dev.lod.coop/essglobal/2.1/standard/organisational-structure/OS115,,,"2 Hope Cottages
Church Lane",Govilon,Monmouthshire,NP7 9RP,GB,,,,,,,,,https://dev.lod.coop/essglobal/2.1/standard/base-membership-type/BMT30,,,,,,,,,Workers,Limited Partnership,,,Wales,,Live,LP003034,Unknown legal form,1984-05-15,,Metco,
R001715,City Design Co-operative,A workers co-operative.  Landscape architects and urban designers.,https://dev.lod.coop/essglobal/2.1/standard/organisational-structure/OS50,https://dev.lod.coop/essglobal/2.1/standard/activities-ica/ICA110,,"4 North Court
Off St Vincent Place",Glasgow,"Glasgow, City of",G1 2DP,GB,,http://www.citydesign.coop,,,,,SC094759,,https://dev.lod.coop/essglobal/2.1/standard/base-membership-type/BMT30,,,,,,Professional and Legal services,"Professional, Scientific and Technical",71112,Workers,Company,,,Scotland,,Live,SC094759,Companies House,1985-08-19,,City Design Co-operative Limited,
R001718,Sunshine Nursery,"Sunshine Nursery in Kirkcaldy was established in 1990, making us the first private nursery in the area. We then expanded by opening our Glenrothes nursery in 2000. Throughout this time we have succeeded in delivering high quality childcare and continue to be committed in doing so.",https://dev.lod.coop/essglobal/2.1/standard/organisational-structure/OS50,https://dev.lod.coop/essglobal/2.1/standard/activities-ica/ICA270,,"Unit 4 Newark Road South
Eastfield Business Park",Glenrothes,Fife,KY7 4NS,GB,,http://www.sunshinenurseryfife.co.uk/,,,,,SC125072,,https://dev.lod.coop/essglobal/2.1/standard/base-membership-type/BMT30,,,,,,Health and Social Care,Human Health and Social Work,88910,Workers,Company,,,Scotland,,Live,SC125072,Companies House,1990-05-17,,Sunshine Nursery Limited,
R002117,Persuaders Multimedia Design,"With an inspired mix of energy and experience our strength stems from the combination of sound strategic knowledge and a huge love for what we do. With innovative ideas, elegant design and customer focused technology, we are well placed to increase your performance and get results. We are upfront and transparent about everything we do and always meet our deadlines no matter what it takes.

We create user centred design that creates awareness, drives sales and realises competitive advantage. From media rich websites to viral online games, from social media to hi definition video streams.  We would love to meet you and discuss how we could help you achieve your digital aims.",https://dev.lod.coop/essglobal/2.1/standard/organisational-structure/OS50,https://dev.lod.coop/essglobal/2.1/standard/activities-ica/ICA280,,"Loxley House
11 Swan Road",Lichfield,Staffordshire,WS13 6QZ,GB,,http://www.persuaders.co.uk,,,,,02891338,,https://dev.lod.coop/essglobal/2.1/standard/base-membership-type/BMT30,,,,,,"Digital, Media and Communication",Information and Communication,62020,Workers,Company,,,England,,Live,02891338,Companies House,1994-01-25,,Persuaders Multimedia Design Ltd,
R002120,ArtZone Co-operative,"ArtZone Co-operative produces a wide range of art, design and multi media services. Design for print, website construction and content. We work with arts and education organisations, local authorities, trade unions, co-operatives and individuals.",https://dev.lod.coop/essglobal/2.1/standard/organisational-structure/OS50,https://dev.lod.coop/essglobal/2.1/standard/activities-ica/ICA280,,10 Back Church Lane,London,Tower Hamlets,E1 1LX,GB,,http://www.artzone.coop,,,,,02893361,,https://dev.lod.coop/essglobal/2.1/standard/base-membership-type/BMT30,,,,,,Arts and Culture,"Arts, Entertainment and Recreation",90030,Workers,Company,,,England,,Live,02893361,Companies House,1994-02-01,,Art Zone Co-operative Ltd,
R002121,Blakelock Support Services,"A workers co-operative providing day care and domestic home help.

Blakelock Support Services was set up in 1994 to provide domestic cleaning services to the people of Hartlepool. Since then we have extended our services to include Low Level Support, Shopping Service and Ironing and Laundry Service. We adapt our service to your own personal needs and do our best to complete those jobs for you that sometimes you just don't have the time to think about. All of our services are available for a very reasonable price.",https://dev.lod.coop/essglobal/2.1/standard/organisational-structure/OS50,https://dev.lod.coop/essglobal/2.1/standard/activities-ica/ICA270,,"4 Crawford Street
Seaton Carew",Hartlepool,Hartlepool,TS25 1UT,GB,,http://blakelockservices.wixsite.com/cleaning-laundry,,,,,02893705,,https://dev.lod.coop/essglobal/2.1/standard/base-membership-type/BMT30,,,,,,Health and Social Care,Human Health and Social Work,88100,Workers,Company,,,England,,Live,02893705,Companies House,1994-02-01,,Blakelock Elderly Care Co-operative Ltd,
R003521,Nomadic Roots,"Nomadic Roots is a co-operative undertaking research into organic farming methods and techniques, and provides environmental educational facilities for local people.",https://dev.lod.coop/essglobal/2.1/standard/organisational-structure/OS160,https://dev.lod.coop/essglobal/2.1/standard/activities-ica/ICA110,,25 Cunningham Road,Norwich,Norfolk,NR5 8HQ,GB,,,,,,,,,https://dev.lod.coop/essglobal/2.1/standard/base-membership-type/BMT30,,,,,,Professional and Legal services,"Professional, Scientific and Technical",72000,Workers,Unincorporated,,,England,,Live,,Unknown legal form,,,Nomadic Roots,
R003199,Mutual Business Advice,"We are a Workers' Co-operative, specialising in business support and advice to both start up and existing businesses.  By establishing what your co-operative wants to achieve we are able to provide pragmatic, responsive advice across a broad spread of services including business planning, financial forecasting, marketing and promotion, personnel management and development.  Our aim is to promote and develop co-operative enterprise into sustainable businesses where ever possible.",https://dev.lod.coop/essglobal/2.1/standard/organisational-structure/OS50,https://dev.lod.coop/essglobal/2.1/standard/activities-ica/ICA110,,"Braeside
Foxholes Road",Horwich,Bolton,BL6 6AJ,GB,,http://www.mbalimited.co.uk/,,,,,05528601,,https://dev.lod.coop/essglobal/2.1/standard/base-membership-type/BMT30,,,,,,Professional and Legal services,"Professional, Scientific and Technical",70229,Workers,Company,,,England,,Live,05528601,Companies House,2005-08-05,,Mutual Business Advice ltd,
R003480,Arthur's Organics (Arthur Street Trading Company),"Arthur Street Trading is a workers co-operative with social objectives and aims.  We reinvest all profits back into the company to offer a fair price for our products so that they are more accessible for those on lower incomes, create jobs if we can, support local food projects, and support local growers. Buying our products means that you become a part of that positive energy!",https://dev.lod.coop/essglobal/2.1/standard/organisational-structure/OS50,https://dev.lod.coop/essglobal/2.1/standard/activities-ica/ICA90,,"2 Woodyard Cottages
Jubilee Lane",Hull,East Riding of Yorkshire,HU11 5BN,GB,,http://www.arthursorganics.com,,,,,03843444,,https://dev.lod.coop/essglobal/2.1/standard/base-membership-type/BMT30,,,,,,Manufacturing,Manufacturing,10390,Workers,Company,,,England,,Live,03843444,Companies House,1999-09-17,,Arthur Street Trading Company Limited,
R003426,Keith Play Centre,Keith Play Centre Playgroup lies within the campus of Keith Swimming Pool and Keith Grammar School. The Playgroup is located within Keith Sports & Community Centre on the outskirts of Keith on the Banff Road. It is within easy walking distance to the town centre and the main bus routes.,https://dev.lod.coop/essglobal/2.1/standard/organisational-structure/OS50,https://dev.lod.coop/essglobal/2.1/standard/activities-ica/ICA270,,Banff Road,Keith,Moray,AB55 5GT,GB,,,,,,,SC323212,,https://dev.lod.coop/essglobal/2.1/standard/base-membership-type/BMT30,,,,,,Education,Education,85100,Workers,Company,,,Scotland,,Live,SC323212,Companies House,2007-05-08,,Keith Play Centre Ltd,
R003441,Centrifuge Consulting,"Centrifuge Consulting is a social and economic research consultancy based in Northumberland and Scotland. Structured as a workers' co-operative our activities are focused on the interaction of the social and economic, bringing extensive experience of good practice from across the UK and beyond.",https://dev.lod.coop/essglobal/2.1/standard/organisational-structure/OS50,https://dev.lod.coop/essglobal/2.1/standard/activities-ica/ICA110,,"Halidon House
17d Windmill Way West
Ramparts Business Park",Berwick-Upon-Tweed,Northumberland,TD15 1TB,GB,,http://www.centrifuge.coop,,,,,06309686,,https://dev.lod.coop/essglobal/2.1/standard/base-membership-type/BMT30,,,,,,Professional and Legal services,"Professional, Scientific and Technical",70229,Workers,Company,,,England,,Live,06309686,Companies House,2007-07-11,,Centrifuge Consulting Ltd,
R003260,Affinity Woodland Workers Co-operative,"A workers co-operative, Environmental and Conservation work.",https://dev.lod.coop/essglobal/2.1/standard/organisational-structure/OS50,https://dev.lod.coop/essglobal/2.1/standard/activities-ica/ICA10,,"Steward Community Woodland
Moretonhampstead",Newton Abbot,Devon,TQ13 8SD,GB,,http://www.stewardwood.org,,,,,03910698,,https://dev.lod.coop/essglobal/2.1/standard/base-membership-type/BMT30,,,,,,Agriculture,"Agriculture, Forestry and Fishing",01500,Workers,Company,,,England,,Live,03910698,Companies House,2000-01-20,,Affinity Woodland Workers Co-operative ltd,
R003261,Growing Heart,An organic co-operative of farms which grows fruit and vegetables for retail and wholesale. Certified Organic by The Soil Association.,https://dev.lod.coop/essglobal/2.1/standard/organisational-structure/OS50,https://dev.lod.coop/essglobal/2.1/standard/activities-ica/ICA10,,"Hen Parcau Farm
Bwlchygroes",Boncath,Pembrokeshire,SA37 0JY,GB,,http://www.growingheart.co.uk,,,,,03176209,,https://dev.lod.coop/essglobal/2.1/standard/base-membership-type/BMT30,,,,,,Agriculture,"Agriculture, Forestry and Fishing",01130,Workers,Company,,,Wales,,Live,03176209,Companies House,1996-03-21,,Calon yn Tyfu Cyfyngedig,
R003594,Lupine Adventure Co-operative,"Lupine Adventure is a workers' co-operative offering fell and mountain based outdoor recreation, education and training.  We also run rock climbing and hill walking sessions to individuals and groups. Lastly, we have members in Cumbria, Wales and Yorkshire and are available for hire to supervise your outdoor based activities.",https://dev.lod.coop/essglobal/2.1/standard/organisational-structure/OS50,https://dev.lod.coop/essglobal/2.1/standard/activities-ica/ICA280,,"6A Rodley Lane
Rodley",Leeds,Leeds,LS13 1HU,GB,,http://www.lupineadventure.co.uk,,,,,06378809,,https://dev.lod.coop/essglobal/2.1/standard/base-membership-type/BMT30,,,,,,Sports and Recreation,"Arts, Entertainment and Recreation",93290,Workers,Company,,,England,,Live,06378809,Companies House,2007-09-24,,Lupine Adventure Co-operative Limited,
R003595,Fair 4 All Trading,"Fair 4 All is a fair trade shop operating in Warrington Retail Market promoting Fair Trade through retails, education and campaigning.",https://dev.lod.coop/essglobal/2.1/standard/organisational-structure/OS50,https://dev.lod.coop/essglobal/2.1/standard/activities-ica/ICA260,,2 Time Square,Warrington,Warrington,WA1 2NT,GB,,http://www.facebook.com/fair4all,,,,,12528799,,https://dev.lod.coop/essglobal/2.1/standard/base-membership-type/BMT30,,,,,,Retail,Wholesale and Retail; Vehicle Repair,47890,Workers,Company,,,England,,Live,12528799,Companies House,2020-03-20,,Fair 4 All Trading Ltd,
R003596,software.coop,"software.coop is a workers cooperative providing computer-related services, including webmastering/web design, ecommerce/web shops, sysadmin, databases, programming and software development.

We can also arrange hosting, domain name registrations and telephone services; and we develop and distribute debian GNU/Linux and goboLinux, along with much more free software, accompanied by some bespoke training services.",https://dev.lod.coop/essglobal/2.1/standard/organisational-structure/OS115,https://dev.lod.coop/essglobal/2.1/standard/activities-ica/ICA280,,"software.coop
384 Lynn Road",Setchey,Norfolk,PE33 0PD,GB,,http://www.software.coop/,,,,,OC303457,,https://dev.lod.coop/essglobal/2.1/standard/base-membership-type/BMT30,,,,,,"Digital, Media and Communication",Information and Communication,62000,Workers,LLP,,,England,,Live,OC303457,Companies House,2002-11-27,,Turo Technology LLP,
R003553,Mitchell Coxan Creative Communications (MC3),"MC3 is a cooperative partnership, providing services and products built on our skills and expertise in cost-effective communications in the internet age. Combining clear thinking, common sense, and strategic vision with decades of experience in organisational communications makes for a compelling offering.

Based in the village of Slaithwaite in England's South Pennines, MC3 works with clients throughout the UK and Europe, creating and implementing strategies to engage members, customers and other key stakeholders, enabling them to network better with each other and with their parent organisation.

Currently we are two partners, with a growing group of specialist associates whose expertise we can call on as the need arises, enabling us to create and deploy a custom built team of specialists to meet your specific needs.",https://dev.lod.coop/essglobal/2.1/standard/organisational-structure/OS115,https://dev.lod.coop/essglobal/2.1/standard/activities-ica/ICA280,,"58 Varley Road
Slaithwaite",Huddersfield,Kirklees,HD7 5HL,GB,,http://mc3.coop,,,,,OC330863,,https://dev.lod.coop/essglobal/2.1/standard/base-membership-type/BMT30,,,,,,"Digital, Media and Communication",Information and Communication,62000,Workers,LLP,,,England,,Live,OC330863,Companies House,2007-08-24,,Mitchell Coxan Creative Communications LLP,
R002825,The Slipway Co-operative,"A workers co-operative, we build new, repair and restore timber yachts and are passionate about providing you with the, for you, perfect boat.",https://dev.lod.coop/essglobal/2.1/standard/organisational-structure/OS50,https://dev.lod.coop/essglobal/2.1/standard/activities-ica/ICA90,,"Underfall Yard
Shed 2 Cumberland Road",Bristol,"Bristol, City of",BS1 6XG,GB,,http://www.underfallboatyard.co.uk,,,,,04600114,,https://dev.lod.coop/essglobal/2.1/standard/base-membership-type/BMT30,,,,,,Manufacturing,Manufacturing,32990,Workers,Company,,,England,,Live,04600114,Companies House,2002-11-25,,The Slipway Co-operative Ltd,
R002830,Laurieston Hall People Centre,"A workers co-operative, offering training courses and events.",https://dev.lod.coop/essglobal/2.1/standard/organisational-structure/OS130,https://dev.lod.coop/essglobal/2.1/standard/activities-ica/ICA270,,"Laurieston Hall
Laurieston",Castle Douglas,Dumfries and Galloway,DG7 2NB,GB,,,,,,,,,https://dev.lod.coop/essglobal/2.1/standard/base-membership-type/BMT30,,,,,,Education,Education,85320,Workers,Society,,,Scotland,,Live,2596RS,FCA,2002-12-23,,Laurieston Hall People Centre Limited,
R003263,Gaia (Leamington Spa),"Formed in 1997, Gaia was Leamington's first workers co-operative. Its members operate an ethical wholefood shop in the Old Town.

Gaia aims to promote ethical trading by running a profitable wholefood business on ethical principles.",https://dev.lod.coop/essglobal/2.1/standard/organisational-structure/OS50,https://dev.lod.coop/essglobal/2.1/standard/activities-ica/ICA260,,7 Regent Place,Leamington Spa,Warwickshire,CV31 1EH,GB,,http://www.gaia.coop,,,,,03440258,,https://dev.lod.coop/essglobal/2.1/standard/base-membership-type/BMT30,,,,,,Retail,Wholesale and Retail; Vehicle Repair,47210,Workers,Company,,,England,,Live,03440258,Companies House,1997-09-26,,Gaia (Leamington Spa) Limited,
R002847,Footprint Workers Co-operative,"Footprint is a workers co-operative based at Cornerstone Resource Centre, Chapeltown in Leeds. Footprint was set up to provide printing services to the highest possible ethical and environmental standards. We have 2 current members who both live in Cornerstone Housing Co-op and have been involved in social and ecological activism for a number of years.",https://dev.lod.coop/essglobal/2.1/standard/organisational-structure/OS50,https://dev.lod.coop/essglobal/2.1/standard/activities-ica/ICA280,,"16 Sholebroke Avenue
Chapeltown",Leeds,Leeds,LS7 3HB,GB,,http://www.footprinters.co.uk,,,,,03357921,,https://dev.lod.coop/essglobal/2.1/standard/base-membership-type/BMT30,,,,,,Arts and Culture,"Arts, Entertainment and Recreation",90030,Workers,Company,,,England,,Live,03357921,Companies House,1997-04-22,,Footprint Workers Co-operative Ltd.,
R002513,Co-operative and Mutual Solutions (CMS),"Co-operative and Mutual Solutions has been working with co-operative and social enterprises since 2002. We are a worker co-operative ourselves with a passion for values based, member led businesses.

Our directors have over 30 years experience and are active in their local communities and in the co-operative movement regionally and nationally. CMS delivers its services mainly in the North West of England.",https://dev.lod.coop/essglobal/2.1/standard/organisational-structure/OS130,https://dev.lod.coop/essglobal/2.1/standard/activities-ica/ICA110,,"16-17 Victoria Buildings
Waterside",Darwen,Blackburn with Darwen,BB3 3PA,GB,,http://www.cms.coop,,,,,,,https://dev.lod.coop/essglobal/2.1/standard/base-membership-type/BMT30,,,,,,Professional and Legal services,"Professional, Scientific and Technical",70220,Workers,Society,,,England,,Live,29378R,FCA,2002-04-05,,Co-operative and Mutual Solutions Limited,
R002515,Ethos Public Relations,"Ethos public relations offers a wide range of PR and marketing services for businesses large and small. Whether you need a complete communications package, help with a one off project or would like us to deal with social media - we can deliver a cost effective solution.",https://dev.lod.coop/essglobal/2.1/standard/organisational-structure/OS50,https://dev.lod.coop/essglobal/2.1/standard/activities-ica/ICA110,,"The Yew Tree Inn
High Street
Gresford",Wrexham,Wrexham,LL12 8RF,GB,,http://www.ethos-pr.com,,,,,05818774,,https://dev.lod.coop/essglobal/2.1/standard/base-membership-type/BMT30,,,,,,Professional and Legal services,"Professional, Scientific and Technical",70210,Workers,Company,,,Wales,,Live,05818774,Companies House,2006-05-16,,Ethos Public Relations Limited,
R002850,Dynamix,"Dynamix is a workers co-operative based in Swansea, South Wales. We are a training company that specialises in delivering custom training packages designed to suit your needs. We work with a diverse range of organisations to deliver training around serious issues - for example, young peoples rights - in an enjoyable way. After all, if you do not enjoy the training you recieve you're not likely to learn much from it.",https://dev.lod.coop/essglobal/2.1/standard/organisational-structure/OS50,https://dev.lod.coop/essglobal/2.1/standard/activities-ica/ICA120,,"Unit 4D
Cwm Road",Swansea,Swansea,SA1 2AY,GB,,http://www.dynamix.coop,,,,,02413574,,https://dev.lod.coop/essglobal/2.1/standard/base-membership-type/BMT30,,,,,,Other,Other Service Activities,96090,Workers,Company,,,Wales,,Live,02413574,Companies House,1989-08-15,,Dynamix Limited,
R002851,North East Music Co-operative (NEMCO),"In 1995, Newcastle upon Tyne City Council disbanded it's schools instrumental teaching service due to cut backs in funding. In response, 18 peripatetic music teachers from the service formed NEMCO with the full support of the City Council, schools and relevant trade unions to continue offering tuition to schools in the area. Currently, there are 33 teachers (October 2002). In the development report from the Local Authority 2001 it was quoted that approximately 8% of pupils were learning through Nemco and the numbers of pupils had increased by 28%. Nemco has broadened the range of services provided to schools. Nemco was mentioned on David Blunkett's Website - www.davidblunkett.org.uk and in the Co-operative commission report. We also provide tuition in surrounding authorities.",https://dev.lod.coop/essglobal/2.1/standard/organisational-structure/OS50,https://dev.lod.coop/essglobal/2.1/standard/activities-ica/ICA270,,"McCracken Park
Great North Road
Gosforth",Newcastle,Newcastle upon Tyne,NE3 2DT,GB,,http://www.nemco.org.uk,,,,,03079979,,https://dev.lod.coop/essglobal/2.1/standard/base-membership-type/BMT30,,,,,,Education,Education,85590,Workers,Company,,,England,,Live,03079979,Companies House,1995-07-14,,North East Music Co-operative Limited,
R003285,Sez-U Community Theatre,"Sez-U Community Theatre specialises in drawing on the stories and history of individuals, groups and communities to create new and vibrant works of drama.",https://dev.lod.coop/essglobal/2.1/standard/organisational-structure/OS50,https://dev.lod.coop/essglobal/2.1/standard/activities-ica/ICA280,,28 Aylesford Street,Leamington Spa,Warwickshire,CV31 2AH,GB,,http://www.facebook.com/sezucommunitytheatre/,,,,,03669098,,https://dev.lod.coop/essglobal/2.1/standard/base-membership-type/BMT30,,,,,,Arts and Culture,"Arts, Entertainment and Recreation",90010,Workers,Company,,,England,,Live,03669098,Companies House,1998-11-17,,Sez-U Community Theatre Ltd,
R002520,Savant,"An employee owned business, Savant enterprises is a high quality IT Development and Consultancy organisation that takes an engineering approach to software development. On the 4th July 2001 the employees of Savant Group took over the company from the retiring founders in an Employee Buy Out.  The company is now owned by Savant Group - Employee Benefit Trust to which all eligible staff belong. 

The Employees Own Savant
Why Not a Management Buy Out?

The existing management team acknowledged that the main assets of the company go home every night. Without the good will and co-operation of the staff, Savant could not provide the levels of service and support we believe our customers have a right to expect - after all we charge them for it. So the idea of an EBO was born out of the spirit of co-operation - but not necessarily of a co-operative.The current structure and ownership is therefore a two-way street. The company gains commitment from the staff and encourage their involvement,",https://dev.lod.coop/essglobal/2.1/standard/organisational-structure/OS50,https://dev.lod.coop/essglobal/2.1/standard/activities-ica/ICA280,,"Dalton Hall Business Centre
Dalton Lane
Burton-in-Kendal",Carnforth,Cumbria,LA6 1BL,GB,,http://www.savant.co.uk,,,,,02077844,,https://dev.lod.coop/essglobal/2.1/standard/base-membership-type/BMT30,,,,,,"Digital, Media and Communication",Information and Communication,62012,Workers,Company,,,England,,Live,02077844,Companies House,1986-11-27,,Savant Limited,
R003287,Theatre Absolute Limited,"Theatre Absolute is an award winning new writing theatre company.  Founded in 1992, and based in Coventry, the company is a Key Regional Organisation, funded by Arts Council England, West Midlands. We commission, produce and tour new plays which are bold, uncompromising and contemporary.  Ultimately, we aim to give to our audience a total theatre experience that is exciting, compelling and entertaining. Theatre Absolute are committed to working with new artists at every possible opportunity; we constantly seek out new creative impulses to compliment and drive forward the artistic vision of the company's core members, Chris O'Connell (Artistic Director and writer) and Julia Negus (Producer).",https://dev.lod.coop/essglobal/2.1/standard/organisational-structure/OS50,https://dev.lod.coop/essglobal/2.1/standard/activities-ica/ICA280,,38 City Arcade,Coventry,Coventry,CV1 3HW,GB,,http://www.theatreabsolute.co.uk,,,,,02966897,,https://dev.lod.coop/essglobal/2.1/standard/base-membership-type/BMT30,,,,,,Arts and Culture,"Arts, Entertainment and Recreation",90030,Workers,Company,,,England,,Live,02966897,Companies House,1994-09-12,,Theatre Absolute Limited,
