Identifier,Name,Description,Organisational Structure,Primary Activity,Activities,Street Address,Locality,Region,Postcode,Country ID,Territory ID,Website,Phone,Email,Twitter,Facebook,Companies House Number,Qualifiers,Membership Type,Latitude,Longitude,Geo Container,Geo Container Latitude,Geo Container Longitude,Sector,SIC Section,SIC Code,Ownership Classification,Legal Form,Legal Form Subcategory 1,Legal Form Subcategory 1,UK Nation,Type of Organisation,Registered Status,Registered Number,Registrar,Incorporation Date,Dissolved Date,Organisation Name,WC Legal Form
R025671,Metro-Boulot-Dodo,"MBD creates beautiful and emotive storytelling experiences using virtual reality, augmented reality and large scale projection. We use a blend of traditional arts expertise and technological innovation to bring stories to life. MBD tells stories from our past and present to create a better future.",https://dev.lod.coop/essglobal/2.1/standard/organisational-structure/OS50,https://dev.lod.coop/essglobal/2.1/standard/activities-ica/ICA280,,2-4 Silver Walk,Leicester,Leicester,LE1 5EW,GB,,http://www.mbd.limited,,,,,04711097,,https://dev.lod.coop/essglobal/2.1/standard/base-membership-type/BMT30,,,,,,Arts and Culture,"Arts, Entertainment and Recreation",90030,Workers,Company,,,England,,Live,04711097,Companies House,2003-03-25,,Metro-Boulot-Dodo Limited,
R033362,With Compliments Workers' Cooperative,"With Compliments aims to deliver holistic therapies and education that will engage, encourage and inspire a new way of living.",https://dev.lod.coop/essglobal/2.1/standard/organisational-structure/OS130,https://dev.lod.coop/essglobal/2.1/standard/activities-ica/ICA270,,43 Oranmore Street,Belfast,Belfast,BT13 3RU,GB,,http://www.facebook.com/profile.php?id=100078006350052,,,,,,,https://dev.lod.coop/essglobal/2.1/standard/base-membership-type/BMT30,,,,,,Health and Social Care,Human Health and Social Work,86900,Workers,Society,,,Northern Ireland,,Live,4821,FCA,2021-07-19,,With Compliments Workers' Cooperative Limited,
R015180,The Bicycle Co-operative,"Our aim is to provide Jersey with affordable bikes, clothing and accessories for all the family. From your child's first stabilisers, to electric bikes, through to top of the range racing thoroughbreds. We also offer bike servicing plus a full range of cycling accessories.

We are a worker co-operative, which means our staff are effectively part owners, motivated to provide you with exceptional service. Cycling is becoming more and more popular and we want to encourage everyone to use their bikes more often, whether it be for recreational use, commuting or even competing! As you will see, we have bikes for every member of your family, including electric assisted bikes for those who want a helping hand with the many hills we have to face around the island.

So please do pop into the shop, see what we have to offer and have a chat with one of our friendly staff.",https://dev.lod.coop/essglobal/2.1/standard/organisational-structure/OS50,https://dev.lod.coop/essglobal/2.1/standard/activities-ica/ICA260,,"9 La Ville Vautier
La Rue Des Cosnets",St Ouen,,JE3 2WF,JE,,http://coopbikes.com/,,,,,119598,,https://dev.lod.coop/essglobal/2.1/standard/base-membership-type/BMT30,,,,,,Retail,Wholesale and Retail; Vehicle Repair,47640,Workers,Company,,,Jersey,,Live,119598,Companies House,2015-09-30,,The Bicycle Co-operative Ltd,
R031073,Green Bay Projects,Consultancy and education on the ideas of Resilience Theory,https://dev.lod.coop/essglobal/2.1/standard/organisational-structure/OS130,https://dev.lod.coop/essglobal/2.1/standard/activities-ica/ICA110,,135 Lincoln Street,Norwich,Norfolk,NR2 3JZ,GB,,,,,,,,,https://dev.lod.coop/essglobal/2.1/standard/base-membership-type/BMT30,,,,,,Professional and Legal services,"Professional, Scientific and Technical",72200,Workers,Society,,,England,,Live,4748,FCA,2020-11-09,,Green Bay Projects Limited,
R031115,Edinburgh Agroecology Co-op / Lauriston Farm,"Transforming an existing farm into an urban food production and community hub that benefits, supports and regenerates the environment and all those connected to it.",https://dev.lod.coop/essglobal/2.1/standard/organisational-structure/OS120,https://dev.lod.coop/essglobal/2.1/standard/activities-ica/ICA10,,23 Lixmount Avenue,Edinburgh,City of Edinburgh,EH5 3EW,GB,,http://www.lauristonfarm.scot,,,,,SC668231,,https://dev.lod.coop/essglobal/2.1/standard/base-membership-type/BMT30,,,,,,Agriculture,"Agriculture, Forestry and Fishing",01130,Workers,Community Interest Company,,,Scotland,,Live,SC668231,Companies House,2020-07-21,,Edinburgh Agroecology Co-op CIC,
R030138,The Psychedelic Society,The Psychedelic Society believes the conscious use of psychedelics can help create a more compassionate and joyful world through an appreciation of the unity and interconnectedness of all things.,https://dev.lod.coop/essglobal/2.1/standard/organisational-structure/OS50,https://dev.lod.coop/essglobal/2.1/standard/activities-ica/ICA280,,8 Heath Way,Totnes,Devon,TQ9 5GP,GB,,https://dandelion.coop/,,,,,09603539,,https://dev.lod.coop/essglobal/2.1/standard/base-membership-type/BMT30,,,,,,"Membership associations, social clubs and trade unions",Other Service Activities,94990,Workers,Company,,,England,,Live,09603539,Companies House,2015-05-21,,Dandelion Collective Ltd,
R029754,Trademark Belfast Cooperative,"Established in 2001, Trademark is the anti-sectarian unit of the Irish Congress of Trade Unions (ICTU) dedicated to challenging inequality through community and workplace interventions, education and research on a range of themes including peace-building, community relations and political economy.

For almost three decades Trademark and its predecessor, Counteract, have been at the forefront of efforts to provide a trade-union based analysis of and response to the constitutional, political, economic and conflict-related challenges facing Northern Ireland. From our base on the Falls/Shankill interface in West Belfast, Trademark operates on an all-island basis and is proactive in encouraging various constituencies – public agencies, political parties, trade unions, interface communities, migrant workers and minority ethnic communities, ex-prisoners – to engage in dialogue around the constitutional question and the possibilities for building a better social and economic future in Ireland.

From its inception Trademark has functioned as a roving community and workers’ college, delivering core trade union education in addition to bespoke political economy programmes developed in the wake of the 2007/08 financial crisis. We have been working consistently to embed radical political education in the Irish and British trade union movements, with the aim of ‘growing’ a cohort of trade union activists that are equipped with the tools to understand, analyse and critique the system as well as advance progressive alternatives. We see education linked to organising and

We also work closely with trade union, grassroots civil society and left political actors across Europe to promote alternative economic and political strategies.

Worker and community-owned co-operative enterprises can offer a practical alternative means to create employment, tackle economic inequality and also build a class consciousness by bringing workers together daily to work democratically for joint benefit in which values of trust and democracy replace the dynamics of suspicion and mistrust, building permanent structures with real relationships.

Trademark assists in the development of community- and worker-owned co-operatives by engaging with those who have yet not participated in what can often be short term impermanent peace building activities, in developing successful business ventures they can contribute to economic security and community regeneration leaving a genuine legacy of sustainability and social justice.

Trademark is a member of the Worker Cooperative Network which brings together worker cooperative from across the island of Ireland to promote worker cooperatives  and inter-cooperation.

Trademark is also a supporter of the Belfast Cleaning Society and were founding members of a Co-operative Development body, Co-operative Alternatives",https://dev.lod.coop/essglobal/2.1/standard/organisational-structure/OS130,https://dev.lod.coop/essglobal/2.1/standard/activities-ica/ICA110,,"NG2 North Building
Twin Spires Centre
155 Northumberland Street",Belfast,Belfast,BT13 2JF,GB,,http://www.trademarkbelfast.com,,,,,,,https://dev.lod.coop/essglobal/2.1/standard/base-membership-type/BMT30,,,,,,Professional and Legal services,"Professional, Scientific and Technical",74000,Workers,Society,,,Northern Ireland,,Live,4685,FCA,2020-02-19,,Trademark Belfast Cooperative Limited,
R020574,Third Sector Accountancy,"Third Sector Accountancy are a non-profit organisation firm of Chartered Accountants and Registered Auditors offering accountancy services primarily to those in the third sector. 

Third Sector Accountancy are unique in offering an ethical and co-operative approach to the provision of financial services.

We're a team of 16 people, able to offer a wealth of accounting, auditing and book-keeping experience and skills.",https://dev.lod.coop/essglobal/2.1/standard/organisational-structure/OS50,https://dev.lod.coop/essglobal/2.1/standard/activities-ica/ICA110,,"Holyoake House
Hanover Street",Manchester,Manchester,M60 0AS,GB,,http://www.thirdsectoraccountancy.coop,,,,,10581248,,https://dev.lod.coop/essglobal/2.1/standard/base-membership-type/BMT30,,,,,,Professional and Legal services,"Professional, Scientific and Technical",69200,Workers,Company,,,England,,Live,10581248,Companies House,2017-01-24,,Third Sector Accountancy Limited,
R000694,4 Seasons (Hull),4 Seasons (Hull) is a co-operative based in Hull and supported by Mencap with a single aim; to provide people with a learning disability the opportunity to participate in rewarding and meaningful employment in a horticultural setting.,https://dev.lod.coop/essglobal/2.1/standard/organisational-structure/OS50,https://dev.lod.coop/essglobal/2.1/standard/activities-ica/ICA120,,"C/O Sandhill Garden Centre
Wyton Road
Preston",Hull,East Riding of Yorkshire,HU12 8TY,GB,,http://4-seasons.org,,,,,03496992,,https://dev.lod.coop/essglobal/2.1/standard/base-membership-type/BMT30,,,,,,Housing,Administrative and Support Services,81300,Workers,Company,,,England,,Live,03496992,Companies House,1998-01-22,,4 Seasons (Hull) Ltd,
R000149,Brixton Cycles,A workers co-operative selling bikes and all things to do with bikes.,https://dev.lod.coop/essglobal/2.1/standard/organisational-structure/OS50,https://dev.lod.coop/essglobal/2.1/standard/activities-ica/ICA260,,"296 - 298 Brixton Rd
Brixton",London,Lambeth,SW9 6AG,GB,,http://www.brixtoncycles.co.uk,,,,,01772005,,https://dev.lod.coop/essglobal/2.1/standard/base-membership-type/BMT30,,,,,,Retail,Wholesale and Retail; Vehicle Repair,47789,Workers,Company,,,England,,Live,01772005,Companies House,1983-11-22,,Brixton Cycles Limited,
R000168,Hackney Co-operative Developments (HCD),"Hackney Co-operative Developments (HCD) is a not for profit voluntary sector organisation with over 20 years experience delivering Central Government and European Union regeneration programmes. HCD provides premises for over 50 local businesses, voluntary organisations and community groups, and has provided development support, business advice and training to hundreds of local people every year.",https://dev.lod.coop/essglobal/2.1/standard/organisational-structure/OS120,https://dev.lod.coop/essglobal/2.1/standard/activities-ica/ICA110,,62 Beechwood Road,London,Hackney,E8 3DY,GB,,http://www.hcd.coop/,,,,,01673378,,https://dev.lod.coop/essglobal/2.1/standard/base-membership-type/BMT30,,,,,,Professional and Legal services,"Professional, Scientific and Technical",70220,Workers,Community Interest Company,,,England,,Live,01673378,Companies House,1982-10-21,,Hackney Co-operative Developments Community Interest Company,
R001734,Assist Architects,Assist Architects are a co-operatively run Architectural Practice with extensive experience in both New Build and Refurbishment housing projects providing a successful participatory design service to both community led organisations and the private sector.,https://dev.lod.coop/essglobal/2.1/standard/organisational-structure/OS50,https://dev.lod.coop/essglobal/2.1/standard/activities-ica/ICA110,,94 Kerr Street,Glasgow,"Glasgow, City of",G40 2QP,GB,,http://www.assistdesign.co.uk,,,,,SC084543,,https://dev.lod.coop/essglobal/2.1/standard/base-membership-type/BMT30,,,,,,Professional and Legal services,"Professional, Scientific and Technical",71111,Workers,Company,,,Scotland,,Live,SC084543,Companies House,1983-09-09,,Assist Architects Limited,
R002153,Millrace Furniture Restoration Co-operative,"A workers co-operative and social firm, working with people recovering from mental health problems, offering a range of services to the public, including furniture restoration, french polishing and picture framing.",https://dev.lod.coop/essglobal/2.1/standard/organisational-structure/OS50,https://dev.lod.coop/essglobal/2.1/standard/activities-ica/ICA90,,"Moulsham Mill
Parkway",Chelmsford,Essex,CM2 7PX,GB,,http://www.millracefurniture.co.uk,,,,,03038603,,https://dev.lod.coop/essglobal/2.1/standard/base-membership-type/BMT30,,,,,,Manufacturing,Manufacturing,31090,Workers,Company,,,England,,Live,03038603,Companies House,1995-03-28,,Millrace Furniture Restoration Co-operative Ltd,
R002155,Notts Home Care,"Notts Homecare Ltd is a not-for-profit care co-operative, offering practical care services to care for your loved one. Because we’re not focused on making a profit, our services are extremely reasonable and affordable, with no extras and no minimum order for us to help you. In fact, if you only need 15 minutes help, that’s all you need to pay for! And we don’t charge for travel time costs, unlike other agencies.

We’re focused on you and what your family needs to make life easier for everyone, and we provide services to keep your loved one in the familiar surroundings of their own home. We’re a small company and we’re on first name terms with every client, enabling us to understand their situation and provide exactly what they need.

Our friendly team are professional, well-trained and take pride in providing an excellent, personalised service for all of our clients.",https://dev.lod.coop/essglobal/2.1/standard/organisational-structure/OS50,https://dev.lod.coop/essglobal/2.1/standard/activities-ica/ICA270,,"The Counting House
Forest Road
New Ollerton",Newark,Nottinghamshire,NG22 9QS,GB,,http://www.nottshomecareltd.co.uk,,,,,03056359,,https://dev.lod.coop/essglobal/2.1/standard/base-membership-type/BMT30,,,,,,Health and Social Care,Human Health and Social Work,88100,Workers,Company,,,England,,Live,03056359,Companies House,1995-05-15,,Notts Home Care Limited,
R002157,Environmental Conservation Co-operative (ECCO),"A workers co-operative. The Environmental Conservation Co-operative (ECCO) was incorporated in June 1995, under the auspices of Harlow Co-operative Development Agency.  Offers complementary areas of expertise include: environmental education, energy efficiency and business and marketing skills.",https://dev.lod.coop/essglobal/2.1/standard/organisational-structure/OS50,https://dev.lod.coop/essglobal/2.1/standard/activities-ica/ICA230,,"Ecco St. James Centre
East Road",Harlow,Essex,CM20 2SX,GB,,http://www.ecco.org.uk,,,,,03064585,,https://dev.lod.coop/essglobal/2.1/standard/base-membership-type/BMT30,,,,,,Energy and Environment,Water Supply; Sewerage and Waste,38110,Workers,Company,,,England,,Live,03064585,Companies House,1995-06-05,,Environmental Conservation Co-operative ltd.,
R002402,Otherwords,A workers co-operative,https://dev.lod.coop/essglobal/2.1/standard/organisational-structure/OS50,https://dev.lod.coop/essglobal/2.1/standard/activities-ica/ICA110,,"Unit 3, Business Development Centre
7-15 Greatorex Street",London,Tower Hamlets,E1 5NF,GB,,,,,,,03726539,,https://dev.lod.coop/essglobal/2.1/standard/base-membership-type/BMT30,,,,,,Professional and Legal services,"Professional, Scientific and Technical",70229,Workers,Company,,,England,,Live,03726539,Companies House,1999-03-04,,Otherwords Ltd.,
R001756,Charlton Triangle Kids Club,Charlton Triangle Kids Club is a workers co-operative providing childcare services.,https://dev.lod.coop/essglobal/2.1/standard/organisational-structure/OS50,https://dev.lod.coop/essglobal/2.1/standard/activities-ica/ICA270,,776/778 Barking Road,London,Newham,E13 9PJ,GB,,http://www.trianglekids.co.uk,,,,,04733715,,https://dev.lod.coop/essglobal/2.1/standard/base-membership-type/BMT30,,,,,,Education,Education,85200,Workers,Company,,,England,,Live,04733715,Companies House,2003-04-14,,Charlton Triangle Kids Club ltd.,
R002183,Redress,"ReDress is a worker co-operative that promotes Social Firm Principles & Environmental Action. ReDress Reduces, Reuses and Recycles textiles whilst enhancing choices and employment opportunities with and for people with disabilities. ReDress creates unique new creations fashioned from Recycled materials and textiles salvaged from assorted disposal routes. Donations are appreciated. We also do repairs, refitting and fancy dress.",https://dev.lod.coop/essglobal/2.1/standard/organisational-structure/OS50,https://dev.lod.coop/essglobal/2.1/standard/activities-ica/ICA90,,"Earth Balance
West Sleekburn Farm
Bomarsund",Bedlington,Northumberland,NE22 7AD,GB,,http://www.redressltd.co.uk,,,,,03401377,,https://dev.lod.coop/essglobal/2.1/standard/base-membership-type/BMT30,,,,,,Manufacturing,Manufacturing,14190,Workers,Company,,,England,,Live,03401377,Companies House,1997-07-10,,Redress Limited,
R002482,Trimdon's Little Tykes,"Trimdon's Little Tykes provides a homely, warm and safe environment for up to 22 children between the ages of 0-8 years.

We are a small business run as a workers co-operative. All directors manage the business and make decisions jointly. All directors are Early Years Practitioners and very hands on. All of our practitioners are qualified at Level 3 or above with a passionate approach to children's learning and development. All staff hold current Paediatric First Aid certificates and have had a Disclosure and Barring Services (DBS) check carried out on them.

Our aim is to provide unique learning experiences and a high level of care at all times. The nursery is split into two rooms depending on age group and stage of development and each room has access to our enclosed outdoor environment. We follow the Early Years Foundation Stage (EYFS) which covers children's development and learning from birth to five years. The EYFS is designed to deliver improved outcomes for all children, across every area of learning and development.",https://dev.lod.coop/essglobal/2.1/standard/organisational-structure/OS50,https://dev.lod.coop/essglobal/2.1/standard/activities-ica/ICA270,,"Trimdon House
Landreth Grove
Trimdon Village",Trimdon,County Durham,TS29 6QH,GB,,http://www.trimdonslittletykesltd.co.uk,,,,,04421850,,https://dev.lod.coop/essglobal/2.1/standard/base-membership-type/BMT30,,,,,,Health and Social Care,Human Health and Social Work,88910,Workers,Company,,,England,,Live,04421850,Companies House,2002-04-22,,Trimdon's Little Tykes Ltd,
R002406,News from Nowhere Bookshop,"News From Nowhere Radical & Community Bookshop has served Liverpool, the North West, and beyond, with the best in radical literature since 1974.  It's run on a not-for-profit basis by News From Nowhere Co-operative - a women's collective of five permanent, paid bookshop workers. Very often we have volunteer help too.",https://dev.lod.coop/essglobal/2.1/standard/organisational-structure/OS130,https://dev.lod.coop/essglobal/2.1/standard/activities-ica/ICA260,,96 Bold Street,Liverpool,Liverpool,L1 4HY,GB,,http://www.newsfromnowhere.org.uk,,,,,,,https://dev.lod.coop/essglobal/2.1/standard/base-membership-type/BMT30,,,,,,Retail,Wholesale and Retail; Vehicle Repair,47000,Workers,Society,,,England,,Live,24524R,FCA,1984-06-19,,News from Nowhere Co-operative Limited,
R002407,Latitude Consortium,"A workers co-operatve.  Training & development consultancy specialising in public & social welfare law - equality and diversity, community care, immigration, employment discrimination, social security etc.",https://dev.lod.coop/essglobal/2.1/standard/organisational-structure/OS50,https://dev.lod.coop/essglobal/2.1/standard/activities-ica/ICA110,,60 Tunnel Road,Tunbridge Wells,Kent,TN1 2BU,GB,,http://www.latitudeconsortium.com,,,,,03799056,,https://dev.lod.coop/essglobal/2.1/standard/base-membership-type/BMT30,,,,,,Professional and Legal services,"Professional, Scientific and Technical",70229,Workers,Company,,,England,,Live,03799056,Companies House,1999-07-01,,Latitude Consortium Ltd.,
R002408,Breadline Co-operative,Cafe and bakery. A workers co-operative.,https://dev.lod.coop/essglobal/2.1/standard/organisational-structure/OS50,https://dev.lod.coop/essglobal/2.1/standard/activities-ica/ICA260,,"Unit 4, Beanhill Shops
Dodkin
Beanhill",Milton Keynes,Milton Keynes,MK6 4LP,GB,,,,,,,03024598,,https://dev.lod.coop/essglobal/2.1/standard/base-membership-type/BMT30,,,,,,Retail,Wholesale and Retail; Vehicle Repair,47240,Workers,Company,,,England,,Live,03024598,Companies House,1995-02-21,,Breadline Co-operative Ltd,
R002410,Letterbox Library,"Letterbox Library is a non-profit driven workers co-operative. It was started eighteen years ago by two single mothers operating from home, who wished to provide multicultural and non-sexist books for children - offering essential topics and titles which were sadly neglected by mainstream booksellers. Over the years we have expanded but still hold firm to our co-operative values of self-help, self-responsibility, democracy, equality, equity and solidarity. Our books can be found within educational institutions, libraries and homes throughout the UK and abroad. Customers come to us primarily for our unique book selection service.",https://dev.lod.coop/essglobal/2.1/standard/organisational-structure/OS50,https://dev.lod.coop/essglobal/2.1/standard/activities-ica/ICA260,,"c/o Letterbox Library
Unit 151 Stratford Workshops
Burford Road",Stratford,Newham,E15 2SP,GB,,http://www.letterboxlibrary.com,,,,,01754656,,https://dev.lod.coop/essglobal/2.1/standard/base-membership-type/BMT30,,,,,,Retail,Wholesale and Retail; Vehicle Repair,47910,Workers,Company,,,England,,Live,01754656,Companies House,1983-09-20,,Childrens Books Limited,
R002411,Surface Gallery,"A workers co-operatve.  Surface Gallery is a co-operative volunteer-run independent gallery in the centre of Nottingham. We have slots reserved each year for International, Midlands-Artists, Student, and Community-based shows, and Open shows which bring together artists working in similar media. We also run the very popular Postcard Show each year (for postcard-sized work) for which every piece of work submitted is exhibited, and a Volunteer Show as a reward for the work done by the volunteers.

Surface Gallery offers exhibition space to local, national and international artists of all disciplines. It aims to raise awareness of the visual arts in Nottingham and to offer the public the opportunity to engage with work of a high professional standard. We hope to forge links with the high population of artists in the region and to offer the services they desire. Alongside this the gallery will continue to support emerging artists and intends to allocate a specific period for student exhibit",https://dev.lod.coop/essglobal/2.1/standard/organisational-structure/OS130,https://dev.lod.coop/essglobal/2.1/standard/activities-ica/ICA280,,16 Southwell Road,Nottingham,Nottingham,NG1 1DL,GB,,http://www.surfacegallery.org,,,,,,,https://dev.lod.coop/essglobal/2.1/standard/base-membership-type/BMT30,,,,,,Arts and Culture,"Arts, Entertainment and Recreation",90030,Workers,Society,,,England,,Live,28993R,FCA,1999-10-07,,Surface Gallery Limited,
R002417,Abbey Road Kids Club,"A workers co-operative.

Abbey Road Kids Club Ltd was registered in 2000 and is on the Early Years Register and the compulsory and voluntary parts of the Childcare Register. It operates from rooms within Abbey Road Primary School in Edwalton. There is an enclosed outdoor play area adjacent to the building. The club employs 15 members of childcare staff, eight of whom hold appropriate early years qualifications at level 3.",https://dev.lod.coop/essglobal/2.1/standard/organisational-structure/OS50,https://dev.lod.coop/essglobal/2.1/standard/activities-ica/ICA270,,"8 Cragmoor Road
Burton Joyce",Nottingham,Nottinghamshire,NG14 5AR,GB,,,,,,,03929208,,https://dev.lod.coop/essglobal/2.1/standard/base-membership-type/BMT30,,,,,,Health and Social Care,Human Health and Social Work,88910,Workers,Company,,,England,,Live,03929208,Companies House,2000-02-18,,Abbey Road Kids Club Ltd.,
